Game,Game ID,Review,Review Type
Cities: Skylines II,949230,The game is good. Works better than i saw on release. Only gripe so far is that the houses complain of high rent but it doesn't tell you how to solve and dropping rent rates doesn't fix.,Positive
Cities: Skylines II,949230,Very entertaining and fon.,Positive
Cities: Skylines II,949230,"I loved CS1. I heavily modded CS1.Cities Skylines II is exactly what I hoped. A great foundation for future DLC and mods.There have been issues yes, but updates have come fast. I am very optimistic. I can't go back to CS1 after playing this.",Positive
Cities: Skylines II,949230,"For some reason I could never get into the first game, so I don't have a great way to compare. But after getting the hang of some of the mechanics of this game, wow. It's a lot of fun. It's rewarding to see your city grow and the attention to detail is really nice. It feels like a living world. It also has the same ""just one more turn"" type of hook like the Civilization series.",Positive
Cities: Skylines II,949230,The Game is Great. It may have a few flaws but overall its only the beginning and i know it is going to only get better.,Positive
Cities: Skylines II,949230,I love this game so much! Its so much fun and I find it a little easier to navigate building a city than in CS1. I love the details of the building and citizens,Positive
Cities: Skylines II,949230,"Still rough and needs Mod's to finish fleshing it out, but a worthy successor to the CS1",Positive
Cities: Skylines II,949230,"Lots of computer performance questions - particularly important as your city grows larger. However, if you have the horsepower, this is a truly remarkable game. There are many improvements over the first major version, which lasted nearly 10 years and had tons of DLC love, so a large community exists already. I'm most impressed by the simulation algorithm, which has moved forward in significant ways. People have their entire lives charted and take actions that are commensurate - going to work, going shopping, going to schools in the area, etc. There are certainly many little bugs and behavioral patterns to work out, but I'm confident the Colossal Order team is committed to perfecting this beast. It's enormously fun, and a big step forward in city sim builders.",Positive
Cities: Skylines II,949230,"Game have its problems, but its still more positive than negative. Ammount of detail in game is amazing. Game is in different level than orginal CS1.But if not sure that you want play now, wait month or two.",Positive
Cities: Skylines II,949230,not as bad as people say,Positive
Cities: Skylines II,949230,"Bit buggy, but definitely getting better.  I have been enjoying it more than CS1",Positive
Cities: Skylines II,949230,"it doesn't seem like a ""finished"" product, has many bugs but still it's fun to play and hopefully all will be fixed in the near future",Positive
Cities: Skylines II,949230,Completely unoptimized. constant black screens and coming back to windows. But overall new road system is worth upgrading from part 1,Positive
Cities: Skylines II,949230,city game gud,Positive
Cities: Skylines II,949230,Simply love this game.,Positive
Cities: Skylines II,949230,its ight,Positive
Cities: Skylines II,949230,This is a Good game.,Positive
Cities: Skylines II,949230,ababababbabaabbaa,Positive
Cities: Skylines II,949230,fun,Positive
Cities: Skylines II,949230,"I certainly recommend this game wholeheartedly, it is fun watching your city grow and develop. The designers have done a great job, love it.",Positive
Cities: Skylines II,949230,"High hopes for this game with new content and DLC and mods. As a base game, it is very promising despite the performance issues.",Positive
Cities: Skylines II,949230,Made my computer turn into a space heater but had to for maximum profits!,Positive
Cities: Skylines II,949230,"building game builds, must play building builder game",Positive
Cities: Skylines II,949230,i like it,Positive
Cities: Skylines II,949230,"Do I recommend this game? Yes, but...Honestly, I want to love this game, but there are so many little things that annoy me I just can't. I am addicted to it and hate it all at the same time.My biggest frustration is it is absolutely brutal when it comes to being a perfectionist. If I want a 90 degree angle I want a 90 degree angle. Not 90.01 so that as I get further in my city development of city streets the entire grid system goes to hell. It has literally ruined every city that I have tried to build.My other frustration is that there is no undo button. If you are using the landscaping tool and botch it...that's it no way to fix it...just live with it.Yes there are a lot of really good qualities to this game, it is absolutely beautiful and its awesome watching your town turn into a city. The freedom to build is only hindered by its minor consistency issues, but those minor issues have become a big deal to me in the long run. I really hope that they end up adjusting little things like this in the future.",Positive
Cities: Skylines II,949230,good game buts needs a bit more work,Positive
Cities: Skylines II,949230,A fine upgrade to the city builder genre,Positive
Cities: Skylines II,949230,bit bug but not bad game,Positive
Cities: Skylines II,949230,Its Cities skylines 2 i mean whats not to love.,Positive
Cities: Skylines II,949230,"amazing graphics and gameplay, missing some stuff but it'll come eventually with mods and DLCs and updates",Positive
Cities: Skylines II,949230,"Great fun, building cities, getting frustrated that the people are stupid with in the game and having to fix the problem, cant wait for dlc",Positive
Cities: Skylines II,949230,very immersive but a bit laggy however not unplayable on min specs like people said it would be,Positive
Cities: Skylines II,949230,Amazing and relaxing game,Positive
Cities: Skylines II,949230,"This game is amazing. Need some improvements but is knew, maybe with time it get better.",Positive
Cities: Skylines II,949230,"it's good, and it will continue to get much better. they had a bad launch, but whining babies who couldn't figure out how to turn a few graphics options off won't stop this train. a good game that will soon be great.",Positive
Cities: Skylines II,949230,Great game!,Positive
Cities: Skylines II,949230,"Enjoyable game to play, has its issues at the moment.But the patches until now have been good, give this game a little time and it will be great.",Positive
Cities: Skylines II,949230,Marvellous game,Positive
Cities: Skylines II,949230,good game,Positive
Cities: Skylines II,949230,"It still has some rough edges, and its full potential won't be unlocked until the modding tools are released early next year, but my playtime total speaks for itself. It's good enough that there's no chance I'll go back to CS1.",Positive
Cities: Skylines II,949230,my preferred city builder and traffic simulator.,Positive
Cities: Skylines II,949230,good,Positive
Cities: Skylines II,949230,good game some technical issues with road building and the building but overall good game,Positive
Cities: Skylines II,949230,"Good update to the game.  I like the new landscaping tools and the road tools are .. a change.  I like the auto grid, but you have to be careful how you use it, easy to get things kind of goofed up - but handy used sparingly.I have heard about, but not experienced any performance issues worth mentioning.The graphics are nice.Fun game, it'll get better as it goes, I'd buy it again.",Positive
Cities: Skylines II,949230,awesome,Positive
Cities: Skylines II,949230,Still has a few bugs and is a bit limited in assets but it's also a month old and has some significant improvements over CS1. Super addictive!,Positive
Cities: Skylines II,949230,"Cities Skylines 2, what to say more.... Be patient with updates, everything will be fixed eventually",Positive
Cities: Skylines II,949230,Very good game. I love that they are constantly working on fixing bugs! They aren't that many either which is amazing.,Positive
Cities: Skylines II,949230,"Yes, It has performance issues, but I would be lying if I didn't say it is as addictive as the first one.",Positive
Cities: Skylines II,949230,"This is one of the best games I've ever played. I can't believe how accurately this game simulates our real lives. Build a big city with everything a city needs. It looks very real when you look at the details of the roads, buildings and people. This is a good game if anyone wants to be creative and improve their skills in management, construction, design, thinking, etc.",Positive
Cities: Skylines II,949230,"Product likes these are a work in progress, and if anything its kept me addicted for quite a bit of time.Its enjoyable, even if you do question the accuracy of the simulation elements. But as I said above, its a work in progress, and just an enjoyable experience.",Positive
Cities: Skylines II,949230,Its pretty good so far,Positive
Cities: Skylines II,949230,"I was very wary of getting this title  because of the mixed reviews it had. All things considered, I'm glad I bought it.",Positive
Cities: Skylines II,949230,"amazingly addictive, once you make money",Positive
Cities: Skylines II,949230,i love slideshows,Positive
Cities: Skylines II,949230,"Really not as buggy or poorly-performing as some say, would recommend.",Positive
Cities: Skylines II,949230,it fun,Positive
Cities: Skylines II,949230,Great game with ideal improvements over CS1. Absolutely needs to be more compatible with avg specs. But I run at 45-55fps and it is serviceable. Would be infinitely more enjoyable if it looked better.,Positive
Cities: Skylines II,949230,"Have really been enjoying Skylines II. I know there have been a lot of complaints about some less-than-polished features, but overall, very enjoyable over the last 80 or so hours I have played. Greatly looking forward to continued updates and new features!",Positive
Cities: Skylines II,949230,Its Cool!!,Positive
Cities: Skylines II,949230,fun,Positive
Cities: Skylines II,949230,Yes.,Positive
Cities: Skylines II,949230,BRING BACK THE WORKSHOP!!!,Positive
Cities: Skylines II,949230,Its great! I though my computer would not handel it but it does and i am getting 35 fps and the graphics are on medium to high,Positive
Cities: Skylines II,949230,its good,Positive
Cities: Skylines II,949230,"Still abit laggy, but fun",Positive
Cities: Skylines II,949230,I HATE HIGH DENSITY HOUSING I HATE HIGH DENSITY HOUSING I HATE HIGH DENSITY HOUSING I HATE HIGH DENSITY HOUSING I HATE HIGH DENSITY HOUSING I HATE HIGH DENSITY HOUSING I HATE HIGH DENSITY HOUSING I HATE HIGH DENSITY HOUSING I HATE HIGH DENSITY HOUSING I HATE HIGH DENSITY HOUSING,Positive
Cities: Skylines II,949230,my pc is pritty good most games 100 fps but this cs2 hammers my pc,Positive
Cities: Skylines II,949230,so fun to play,Positive
Cities: Skylines II,949230,"Buggy at launch, a bit confusing, lacks good maps right now, but it's so clearly a diamond in the rough. I just hope they will allow most of that polishing and sharpening to happen for free and not behind DLC paywalls.",Positive
Cities: Skylines II,949230,Love it!,Positive
Cities: Skylines II,949230,Game good.,Positive
Cities: Skylines II,949230,its cool,Positive
Cities: Skylines II,949230,"Performance aside, this game is a massive step up from CS 1.The simulation and building types are so specific that it makes you very immersed. Making downtown areas is super easy and you don't have to have 20 DLCs to enjoy the game like the previous one. If you have the correct PC for it, would recommend definitely",Positive
Cities: Skylines II,949230,"The game is truly impressive. The terrain tool stands out with its excellence, and I am particularly enamored by the captivating visuals of the game. However, it's worth noting that there are some performance issues and occasional crashes. I'm eagerly anticipating the addition of mods, which I believe will enhance the overall gaming experience.",Positive
Cities: Skylines II,949230,"As an avid fan of all city builders, and huge fan of cities skyline 1, I have really loved playing CS2. The game launched with a rocky start but the dev team has been on top of it with frequent patches and fielding feedback from the community. I enjoy the mechanics of this game compared to it's predecessor and look forward to seeing the game improve some more as modding is released, and the dev team addresses more of the minor bugs.People here complain about it being a half-finished game, but I would disagree. Could it have been pushed back a few weeks to deliver a more polished experience? Sure, but if it were my choice, I would've wanted them to release it anyways so I could start playing as soon as possible.",Positive
Cities: Skylines II,949230,its a great city builder and some people just need to get used to 30-60 fps,Positive
Cities: Skylines II,949230,Hours of entertainment building your own city designs.,Positive
Cities: Skylines II,949230,"Still some bugs, but if I am being honest, the game is much more than I expected, the base vanilla game has so many features that used to be mods I previously downloaded. I would recommend.",Positive
Cities: Skylines II,949230,Life completed,Positive
Cities: Skylines II,949230,You are going to need a beast of machine to play this game. Honestly it flat lined my rig and I had the blue screen of death because I was foolishly using the default graphic settings. My RTX 3060 struggles to run this game and most of my settings are low or off so that my computer does not overheat.  Optimization aside the game is fun city builder and I am going to upgrade my rig soon so that i can enjoy this game in its full glory.,Positive
Cities: Skylines II,949230,"A lot of people keep saying the game is bad due to bugs and what not. Lots of people saying about the performance issues. However if you take the time to try out different graphic settings then you will find you can make the game run extremely smooth.Yes, it would be good to have extra assets and mods but honestly im not too bothered because the game has only been out for a month and i dont expect everything to be perfect, like most people think.",Positive
Cities: Skylines II,949230,Game needs a lot more work. Feels like an early access title.,Negative
Cities: Skylines II,949230,No mods no fun,Negative
Cities: Skylines II,949230,"Unplayable, crash to desktop when attempting to load saves.",Negative
Cities: Skylines II,949230,"The game in the current state is too unfinished to be considered a full release. I've experienced problems with simulation, graphics and processing issues. Per now it also looks like content that should have been released with the game, are postponed to early next year. Since modding is missing, I also find that there is a severe lack in content. Most games released in this state use the label ""early acesss"".In the future this could become a good city builder. As of now I cannot recommend buying it.",Negative
Cities: Skylines II,949230,"Honestly I want to love this game, after falling in love with CS1 a few years ago I jumped the gun and pre-bought this. I have played on and off for a few months now. Whilst the game has some major improvements over the first it is just unplayable in it's current state. Starting with the basics the tutorial  is bare bones and considering how much new content there is there should be a more in depth tutorial. For instance i had a city of around 30,000 with no high residential demand, after watching youtube I realised that I can tax each type of residential differently. Also the game really hates the player placing larger buildings, i have had my pc crash a few times placing the international airport and lag like hell when using other large buildings. The traffic system is messed up as hell. Economy is not fully balanced and can be difficult for new players to understand or even generate money, however this game is much more forgiving with the amount of cash you start with and get per milestone.Ps. for new players if you wanna unlock many development points to begin, place water pumps until lv4 then place the park that costs 5,000 which gives 100xp its tedious and long but you can get to grand metropolis without having a single citizen then plan out the perfect city.",Negative
Cities: Skylines II,949230,"DO NOT BUY, YET, BUT Definitely buy finnished game. Game is crazy fun until late game where export is totaly bugged. Actually they are importing stuff you have and they export nothing. IDK where i got 3 mil per month cashflow.. If cargo would have worked id be billionaire..",Negative
Cities: Skylines II,949230,"Game is totally unstable, unfinished, and incomplete. DO NOT BUY",Negative
Cities: Skylines II,949230,"Needs multiple fixes, consider before buying.",Negative
Cities: Skylines II,949230,Come back in 12 months months.,Negative
Cities: Skylines II,949230,"Crashes for no reason at the most random points, completely unplayable for a long period of time.",Negative
Cities: Skylines II,949230,"I just cant make this game work. Even with unlimited money and everything unlocked. things just don't line up well, or fit properly. I haven't played a city sim since sim city on SNES, so its probably just me...but this was a waste of money for me.",Negative
Cities: Skylines II,949230,"Frequent crashes, bugs, bugs and bugs everywhere, then another crash, more bugs and that's pretty much all it does. It simply isn't playable. It isn't even worthy of the label ""early alpha"", they have YEARS of bugfixes ahead of them until it's anywhere near ready to be released as a beta and maybe they can honestly launch it as a playable version 1.0 around 2035.",Negative
Cities: Skylines II,949230,"Cannot recommend this title at this time.While there are countless improvements over the first title, the performance and stability remains a big issue, more so since the release of the most recent patch this week.previously the game ran fine on my system, with a few stutters and ingame mechanic issues. However, now the game crashes to desktop after 15min of playtime.I've been avoiding the game until a big patch was released, and its now here in time before the holidays. game is fixed, mostly. but stability is now worse than it's ever been.Here's hoping for a hotfix over the next week or so.",Negative
Cities: Skylines II,949230,"I pre-purchased this and only have 37 hours of game play. Its just not fun, give it some time so we can have mods and all that before you purchase or wait for a sale. It's not worth the money in its current state, youre better off getting CS1 and waiting a few years for this one to catch up.",Negative
Cities: Skylines II,949230,"worthless without the modsi'll be happy to change my review after the mod workshop is released, but it seems that DEVs don't care about that part of the game",Negative
Cities: Skylines II,949230,"on low settings with small city its fine, once you get to the 100k mark the simulation itself starts running slow. car takes an hour to get from one side of the street to the other.",Negative
Cities: Skylines II,949230,Revisit in a year.,Negative
Cities: Skylines II,949230,graphics are horrible   dont waste money,Negative
Cities: Skylines II,949230,"Its missing alot. Leaves much to be desired. Not much detail goes into actually building a city. Theres a very limited number of things you can place aswell. Want to build a custom part? too bad nobody will use it. Want a sport complex other than football, soccer, or a pool? Too bad. Want any other building style besides ""European"" or ""North American""? Too bad. Fishing industry? nope. Detailed infrastructure? Nope, everything is done for you magically through the ""industry zoning"". Also if you make every road pedestrian only, people love it. Despite having to walk hours to get anywhere. No options to provide bikes either. Just public transit. Also may god help you if you have more than a single public transit route overlap with another. You will never see it - they just overlap.",Negative
Cities: Skylines II,949230,"Why would a game update change my game settings? Seriously, why would it stop autosaving and crash after an update?It is a actually good game and does not require as much resource as I was afraid of initially. Yet, too many developer changes and small bugs. A bit uncooked.",Negative
Cities: Skylines II,949230,"The economy is completely broken, in the info panel you see you're losing 200k per month but your money keeps increasing... Makes no sense, the first game was much better in every way.",Negative
Cities: Skylines II,949230,not acceptable  Bugs makes it no fun not a pleasure to play this is the SECOND attempt its skylines 2 so why on earth is not working out of the box is really bad,Negative
Cities: Skylines II,949230,"Yeah, The graphic was like a retro game with a medium setting. And when you set to low it like you play on a calculator.Good retro graphic style.Oh the traffic AI is very realistic like like your town is full of reckless drivers.No one drive like a normal person. Or it should be a reckless driver simulator?--------------------Seriously yesterday I start playing a game and suddenly it not render things properly. I have a sad weekend now.",Negative
Cities: Skylines II,949230,"This used to be one of my favorite games - love Cities Skylines 1.  Cities Skylines 2 - has been a buggy mess.  Performance sucks, if you go in potato mode its playable but ugly as sin.  I have a very capable system and its sad to see the game and how bad it is.  The recent update... let me tell you... its neat... Every 5 mins the game is crashing.  Not like a freeze then crash... like literally drawing a road and game crashes.  I have built the same road and the same area 10 times this morning.   In 12 to 24 months.... maybe i could recommend this game... as it stand right now its rough... and thats being nice.  With the say things are going i would say stick with cities skylines 1 for the next 2 years then come back and take a look at this game.  They don't have mod support, map designer, glitches, crashes, performance issues, graphics issues... save the money continue with skylines 1 for the next 24 months.Absolute trash right now... uninstalled after the latest patch they just pushed - it broke the game completely for me.   will check back in 12 months to see where they are and if they made the game better.  Hate pre-ordering top packages just to be let down with half baked goodness.....",Negative
Cities: Skylines II,949230,"Worst optimized game I have ever played.I have i5-8400, GTX 1060 and 16GB of RAM and on the lowest possible graphics settings with 90k population, prioritised simulation speed and 1600x900 resulution 1 min in-game time runs close to 7-10 sec irl. When I'm trying to move a camera while the game is stopped it freezes the game everytime. Oh and it always starts on a wrong monitor and there's no option in-game to change it, you have to change to windowed mode, move the game and change back to full screen.",Negative
Cities: Skylines II,949230,this game runs like ass,Negative
Cities: Skylines II,949230,No,Negative
Cities: Skylines II,949230,terrible game,Negative
Cities: Skylines II,949230,i know its just been released and the devs are still fixing a vast amount of bugs and issues.....BUT the traffic AI is far worse than CS1 traffic AI and this is ruining the game for me as its not authentic traffic behaviour at all. the game dev trailers promised better traffic AI with a more realistic feel but this is not the case at all. silly traffic habbits causing backlogs of traffic for no reason.,Negative
Cities: Skylines II,949230,Third patch and somehow runs worse. Just spent 20 minutes building a freeway exit just for the game to crash. Game hasn't been horrible its just not ready to take out the oven yet. If you're thinking of buying this game I recommend waiting a few more patches and for a sale.,Negative
Cities: Skylines II,949230,"Wow, no modding support at launch, how nice.",Negative
Cities: Skylines II,949230,unfinished,Negative
Cities: Skylines II,949230,"Extremely buggy and limited selection of assets and maps. Even though its the base game, I expected a little more. Seems they scraped by with the bare minimum and still charged pretty high for the game.I do have to say road tools are much better than CS1 and building roads with all the tools is a lot of fun.",Negative
Cities: Skylines II,949230,"As much fun as I have playing this game the lack of optimization this game has cannot be overlooked. I just lost 4 hours of progress because the game crashed. The frame rate drops a considerable amount every time you manipulate the camera in anyway. The game looks good but feels rushed and incomplete. I feel like now I have to save every 10 minuets to ensure I do not lose any progress. Wish I did that earlier because I now have to rebuild my entire city expansion from housing, resources, even to highway infrastructure. In the future when there has been several updates to deal with these issues I would recommend the game, as for now I can't. Buyer beware and now onto taking a long break to deal with the frustration of losing all of my progress.",Negative
Cities: Skylines II,949230,The game is fun to play however there is still a ton of bugs in the game and when going from paused to play the entire game will freeze and will run at 5-10 fps. If you want this game currently just wait until the console version drops and at that point all the bugs will hopefully be fixed.,Negative
Cities: Skylines II,949230,Developers are more focused on bringing expansion packs and dlcs than actually optimising the game,Negative
Cities: Skylines II,949230,Poorly optimized and crashed within 45 minutes of playing.,Negative
Cities: Skylines II,949230,"let steam handle mods, unplayable otherwise at higher populations.",Negative
