Game,Game ID,Review,Review Type
Darkest Dungeon,262060,Punishin but in a fun way.,Positive
Darkest Dungeon,262060,yes go for it,Positive
Darkest Dungeon,262060,i love having a full squad of fully cracked heroes get decimated by a meat guy,Positive
Darkest Dungeon,262060,I'm going to play it over and over again in the future. Both the original iconic game and the many mods available make the possibilities endless.,Positive
Darkest Dungeon,262060,"Horrors beyond your imagination, bad ass characters what more could you ask for?",Positive
Darkest Dungeon,262060,"Amazing game with Audio and Narration, Auto-Save always on, your people will die and it will be many play hours long, But you will enjoy every min or it. The DLC adds on more Bosses and Areas. Multiplayer area is free in the festival area.",Positive
Darkest Dungeon,262060,Challenging Game but really fun.,Positive
Darkest Dungeon,262060,funnuy dead haha machoshist,Positive
Darkest Dungeon,262060,Great Game!,Positive
Darkest Dungeon,262060,"""Many fall in the face of chaos, but not this one. Not Today.""Best dark fantasy dungeon crawler ever.",Positive
Darkest Dungeon,262060,"Leave nothing unchecked, there is much to be found in forgotten places.",Positive
Darkest Dungeon,262060,An enjoyable experience.  Not to mention a ton of mods.,Positive
Darkest Dungeon,262060,"Dark fantasy, strategy, frustration, satisfaction. This game has it all. It's great. You'll lose, characters will die, you'll get frustrated, but when you succeed its oh so great. If you like a bit of a challenge, Darkest Dungeon is great.",Positive
Darkest Dungeon,262060,It's good.,Positive
Darkest Dungeon,262060,Beautifully designed game both stylistically and mechanically,Positive
Darkest Dungeon,262060,"Game need a lot of brain and if you enjoy DnD and turn-base strategy game, this game is for you.",Positive
Darkest Dungeon,262060,"Awesome game, totally recomend !",Positive
Darkest Dungeon,262060,the plague doctor makes me feel things,Positive
Darkest Dungeon,262060,Everything in this game is awesome!!,Positive
Darkest Dungeon,262060,i downloaded this game during finals week and OH BOY was that a mistake,Positive
Darkest Dungeon,262060,great game,Positive
Darkest Dungeon,262060,"""Confidence is a slow and insidious killer."" - Alpha and Omega of this game.",Positive
Darkest Dungeon,262060,"The atmosphere is the best part of this game. I'd probably would have preferred a shorter game though, as by the end it had lost a bit of its charm.",Positive
Darkest Dungeon,262060,Very fun and challenging.,Positive
Darkest Dungeon,262060,Muito bueno,Positive
Darkest Dungeon,262060,Hard but fun,Positive
Darkest Dungeon,262060,"Never thought that I would like a game that tries to make me suffer. But I don't suffer! Every trip into the Dark is a story. Some stories end well, some not... But all of them are amazing and entertaining.And the workshop integration made me play this game for all these years. Thank you very much!",Positive
Darkest Dungeon,262060,consider me addicted. highly recommend.,Positive
Darkest Dungeon,262060,"""Those without stomach for this place must move on.""",Positive
Darkest Dungeon,262060,"Good, recommended by Brubin",Positive
Darkest Dungeon,262060,"Tuff but fair, I would say. Great game!",Positive
Darkest Dungeon,262060,greatest roguelike of all time,Positive
Darkest Dungeon,262060,becuase my dog liked it soo much his thingy went to heaven,Positive
Darkest Dungeon,262060,"very hard, very aaa",Positive
Darkest Dungeon,262060,good,Positive
Darkest Dungeon,262060,Nice!,Positive
Darkest Dungeon,262060,"Addicting game and never gets old. Opulence has become my favorite word, lol.",Positive
Darkest Dungeon,262060,Get this game asap. Finish it. Then add 100 mods. And finally finish it once again. One of my favourite games of all times.,Positive
Darkest Dungeon,262060,its ok,Positive
Darkest Dungeon,262060,great difficulty and marvelous design ...thank you,Positive
Darkest Dungeon,262060,good,Positive
Darkest Dungeon,262060,love this,Positive
Darkest Dungeon,262060,Turn this into a TV show,Positive
Darkest Dungeon,262060,"Very cozy, great game for a stress relief after exhausting day",Positive
Darkest Dungeon,262060,hard but rewarding,Positive
Darkest Dungeon,262060,installed too many mods and it became very quirky but it was pretty fun,Positive
Darkest Dungeon,262060,"Love inventory, skill-matching, incredible graphics, and an overall superior game play? You're going to love Darkest Dungeon I. I'm at a loss for how to progress in this game, but it keeps me coming back, learning more, and enjoying the ride the entire time. Some time in the future, possibly the far future, I hope to enjoy DDII the same way.",Positive
Darkest Dungeon,262060,"Fun, great art style and punishingly difficult.This is the best way to some up this game, due to it's roguelike elements it's extremely addicting trying to figure out the best way to navigate each dungeon with minimal loses and maximum profit.",Positive
Darkest Dungeon,262060,"I lack the necessary self-loathing to play more than 10 minutes at a time. Yes, I get it is a game about pain and suffering. Somehow I thought it could be fun. Oops.",Negative
Darkest Dungeon,262060,"Don't buy this game, spend your money elsewhere",Negative
Darkest Dungeon,262060,"Grindy. Only first 10 hours are fun which in my opinion does not make the price justifiable.Bosses repeat with higher stats. Character structure upgrades basically boil down to stat upgrades.The only fun part is the unique fight mechanics and tactics, but the rest is just dull content in artsy shell. Looks appealing, but hollow inside.",Negative
Darkest Dungeon,262060,"I wasn't a fan of the gameplay or the art direction. The gameplay felt very one-note, and the style made me mostly feel as if I couldn't tell what I was looking at.",Negative
Darkest Dungeon,262060,did not enjoy. screen is super busy and incoherent- every aspect of gameplay is either explained poorly or not at all. its totally unclear how attacks and the turn order work. the music is bad and full of annoying flourishes! which actively clash with the game's intended gloomy theme. the constant narration is obnoxious and cheesy.,Negative
Darkest Dungeon,262060,"If you like a game that punishes you at every opportunity, this is your game.If you suffer from the mental disorder of masochism, this is your game.It could have been a great game, but I've seen all it has to offer after only a few hours... Punish the player for playing the game.Big pass.",Negative
Darkest Dungeon,262060,trash game no help,Negative
Darkest Dungeon,262060,Keeps crashing every 10 minutes.,Negative
Darkest Dungeon,262060,"I really wanted to like this game, but there were some real issues that I'm guessing they've just fixed in Darkest Dungeon II instead.First of all, your biggest enemy isn't really the the enemies in the game, but the fact that your units get stressed out of orbit for pretty much just entering the dungeon or talking to each other. The game should from start have a way better tutorial and functions on how to relieve stress.Second problem, if you think the Random Number Generator is bad in XCOM, then you're going to have a real blast with this one. I know it's supposed to be a bit of the game failing and winning at random, but some runs have just been a complete waste of time entirely because of the RNG in addition to being new to the game.I would recommend this game for people who're getting back-seated while playing and for those who like to do pretty much the same repetitive thing over and over again.",Negative
Darkest Dungeon,262060,The game is good at what it does but for a game as simplistic as this one it is severely overpriced.,Negative
Darkest Dungeon,262060,Frustrating RNG based game.Spending hours leveling heroes to get them wiped out by random skill you can't predict before you see them.,Negative
Darkest Dungeon,262060,This game taught me what Stockholm syndrome feels like,Negative
Darkest Dungeon,262060,"I played 60 hours. I played on the 'easiest' difficulty. I was drawn to this game by the very unique and beautiful art style, fantastic music, and great storytelling. I was aware this game has a reputation for being difficult. I even installed various mods to make it easier because I wanted a casual experience.It wasn't too bad at first, but turns out the game gets 'more difficult' as you progress by turning up the terrible game mechanics to an 11. Enemies start dodging ALL of your attacks, oneshotting or two shotting your entire party with critical hits back to back, the enemy always out speeds you later in the game and always goes first. Traditional elements of strategy you may see in other turn based rpgs becomes less and less important as you progress.It feels absolutely helpless and there's seriously no fun in throwing your highest level heroes at certain dungeons over and over again and having them all die. You spent 15 hours and went through 10 dungeons to level up a fresh party to go after a higher level dungeon? LOL here comes some terrible rng to throw away all of your efforts. Hard games are fun when they feel fair, and you feel rewarded for overcoming the challenge. There's none of that here. Only a smidgen of relief when you finally get lucky and don't get screwed over by unlucky 'randomness'.Final straw for me was losing an entire party of max level heroes, to back to back crits from a basic mob enemy. The basic baddie put my entire team on 'deaths door' in one hit, the turn order reset and he immediately took another turn and proceeded to wipe my party.",Negative
Darkest Dungeon,262060,"Great art, but the difficulty curve is too much of a cliff right at the outset.  Maybe I'll come back to it.",Negative
Darkest Dungeon,262060,no,Negative
Darkest Dungeon,262060,This games actually a deep methodological analysis of what's it like to live in california with crippling anxiety bpd and stress discorders,Negative
Darkest Dungeon,262060,It was a little too dark for me. I ran into too many walls.Careful not to trip,Negative
Darkest Dungeon,262060,not fun,Negative
Darkest Dungeon,262060,Garbage game,Negative
Darkest Dungeon,262060,no,Negative
Darkest Dungeon,262060,I hate the monster crit rate. Nothing should be critting 6 times in a row. Stupid skeleton,Negative
Darkest Dungeon,262060,"I can play Cyberpunk on high settings, but this game lags so much it is unplayable. Known issue with no fix. Mmmph.AMD Ryzen 7 5800H64GB 4800Mhz RAMRadeon 6600M",Negative
Darkest Dungeon,262060,"I was really hopeful about this. But it feels like they took the worst parts of tactical turn based games, explained nothing, and then added a system that takes away what little agency you have. The RNG might kill you in your first encounter in a level 1 quest, and with no way in the early game to deal with speed and hit chance, it felt like whatever I tried wasn't important. The initiative system makes all of the combos I was eager to try pointless.Ultimately when you get to surprise an enemy group, miss all of your attacks, the entire enemy party goes, then goes again before you in the next round, drives your characters insane and they begin skipping turns or auto-passing, you just get to watch an AI battle kill you and fail. And even when you win, you'll just ""randomly"" roll 4 more negative quirks across the whole party.Thoroughly disappointed, the negatives far outweighed the parts I tried to enjoy.",Negative
Darkest Dungeon,262060,Broken on steamdeck. Cannot even leave the first dungeon because the right stick button does nothing.,Negative
Darkest Dungeon,262060,They make it so difficult and unforgiving. Why bother?,Negative
Darkest Dungeon,262060,too hard,Negative
Darkest Dungeon,262060,"The game is so tight on resources that it makes a ""good"" choice to enter a gameplay loop where you recruit heroes just to send them unequipped into dungeons to make some gold, then fire them and repeat the process.",Negative
Darkest Dungeon,262060,"Product refundedA lot of really good ideas and a very distinct style, I really wanted to enjoy this but it completely bored me right out of the gate and never gave me much reason to want to push on. Admittedly I played for a very short amount of time but I guess I expected more from the get-go.",Negative
Darkest Dungeon,262060,"Surprisingly unfulfilling, went in with high expectations I suppose. The presentation is great and the narrator is iconic - but the gameplay?I mean, if you love losing hours of progress to funny number generators, sure, you're gonna be creaming over this one. Maybe I'll give it another go soon, but as of right now this whole game revolves around a snake-oil dice roll gameplay loop I simply cannot be arsed to endure.",Negative
Darkest Dungeon,262060,slowly paced and painfully repetitive. fun in the same way endlessly scrolling social media is fun,Negative
Darkest Dungeon,262060,F this game,Negative
Darkest Dungeon,262060,Boring waste of time,Negative
Darkest Dungeon,262060,Excellent except for violating our common knowledge about probability.,Negative
Darkest Dungeon,262060,"It was fine years ago, but recently the game crashes whenever loading any dungeon. It's unplayable.",Negative
Darkest Dungeon,262060,tedious combat,Negative
Darkest Dungeon,262060,"I was instantly hooked when I started the game, but it all falls apart as soon as you make a mistakes later on.This game is well known for the permanent death mechanic. Early on and in the midgame, this is a fantastic mechanic that really punishes poor play while still giving the player plenty of opportunities to recover from their mistakes.Later in the game, though... If you loses a level 5 or 6 hero, you are looking at literal hours of grinding just to get back to where you were. It isn't interesting. It isn't fun. It doesn't create unique situations. It wastes the player's time with mindless grinding. By this point, you have most of the best trinkets, have seen almost every boss, and are just trying to finish up the game. Being forced to spend hours grinding for levels is not a fun mechanic, and the game does nothing to make leveling any faster.If you have tons of time on your hands, maybe this isn't such a terrible thing. Though, if you have that much time, play something more engaging and interesting.I want to love this game, but I just can't bring myself to finish it after losing a few max level characters to a combination of poor play on my part and an absurd amount of critical hits. Level grinding is an outdated mechanic that ruins the endgame of Darkest Dungeon.",Negative
Darkest Dungeon,262060,"Beyond confusing with numerous things going on and multitude of texts, that will require hours to understand how things work. If a game forces you to read wiki guides to understand its gameplay and to be able to progress it then its not that good of a game.",Negative
Darkest Dungeon,262060,"Randomfest.Oh, and most of mods for it require a paid DLC.",Negative
Darkest Dungeon,262060,Game's just annoying,Negative
Darkest Dungeon,262060,Too much grinding,Negative
Darkest Dungeon,262060,"for others seems like a good game but for me the only thing that ruins the fun of this game is the damn stress system. for me i think its stupid to have, its why i dont like it. if it was to remove it from the game i would probably play it again. but for now i am not liking the gamem, even with mods the game is so sufferable even on the easyest difficulty, this is a good game for those who wana get realy angry at the game. not recommended to play it cause it only makes you angry at the dumb mecanichs",Negative
Darkest Dungeon,262060,Pretty one dimensional combat system do to lack of skill customization and very limited positioning option.Missions feel either boringly easy or unfairly hard.Really sucks that you can't see what you roll or how likely you are to succeed at anything.Not terrible just so many better tactical combat games out there.,Negative
Darkest Dungeon,262060,One of the most overhyped games ever to release outside of anything Final Fantasy. The only thing carrying this game is the artstyle and the narrator...that is it...that is all that is worthwhile in this game.At the highest level of difficulty the only thing worth running are hit chance increases and building to stunlock the enemy while reducing stress and healing. That is it. Same thing every dungeon...no variety.Of the different character classes you can have in your party only like 4 or 5 are really useful. The rest are just not that great.No real replability despite the initial illusion that it might have some.Fanboys are cancerous simps.,Negative
Darkest Dungeon,262060,to much randomness,Negative
Darkest Dungeon,262060,"Darkest Dungeon seems like a great game, but in-game advertisement makes me so angry. I do not want so be harassed every time i open the game.  Greedy, anti-consumer behavior.",Negative
Darkest Dungeon,262060,i really just can't get into this gamei get why people like it but i can't bring myself to play it personally,Negative
Darkest Dungeon,262060,You are not owning the game by developers license.Also must enable telementry otherwise I cannot access DLC? What kind of small dev would do such a thing? I am thinking on returning the game.,Negative
Darkest Dungeon,262060,lcdtm,Negative
Darkest Dungeon,262060,"Not fun at all.The game does a terrible job explaining basic mechanics. Even those shouting ""that is a part of the journey, git gud, this is how the game is supposed to be played"" should be able to admit that the game forces you to look up guides online. Oh, the amount of randomness is overwhelming. No matter how well you party comp is, the monsters just might randomly focus a single character and kill it with 4 crits in a row.The game might be fun for masochists though.",Negative
Darkest Dungeon,262060,"Not very fun, you get to play the same 5 dungeons and you cant use the same characters in at most 3 of the same dungeons without having to bring a new low level character on your team. But if you like to grind and don'd mind restarting a lot its a good game, great art style.",Negative
Darkest Dungeon,262060,"Games that stack everything against you and expect you to have a good time are dog poop. Literally do anything else with your time, this game is a waste of it",Negative
Darkest Dungeon,262060,Darkest Dungeons? more like Darkest Gay Stupid Game,Negative
Darkest Dungeon,262060,"Buy this if you need to be punished.Narration and art are excellent, but the gameplay is frustrating. You can put in a lot of hours and still achieve almost nothing.",Negative
Darkest Dungeon,262060,boring,Negative
Darkest Dungeon,262060,No,Negative
Darkest Dungeon,262060,no,Negative
Darkest Dungeon,262060,A game from people unable to design a difficulty curve or a tooltip explaining anything that is going on who instead of learning anything about a user interface made that selling point,Negative
Darkest Dungeon,262060,"Game relied too much on luck, even you are very skillful and experienced player if you don't have the luck, the game will crush you to the bone, kill all your hero and force you to start over again and again back to 0. It's just not my kind of game even the voice actor and the story is great.",Negative
Darkest Dungeon,262060,A game that has virtually no help and I cannot figure how to initiate combat on first encounter. I spent 15 out of the total 19 minutes of play time looking for how to use the game to start combat. NOTHING. Awful user interface. Refunded.,Negative
Darkest Dungeon,262060,major FPS problem makes game unplayable,Negative
Darkest Dungeon,262060,1. It's a time vampire.2. Even if you play it correctly it will still hit you in the gonads for the lols.3. It's pretty good.If you're looking for a slot machine with extra steps then be my guest!,Negative
Darkest Dungeon,262060,its alright,Negative
Darkest Dungeon,262060,"Horrible on a controller, would not recommend for the steam deck.",Negative
Darkest Dungeon,262060,"Tedious and repetitive. It has its moments, but they are locked behind a ton of grind.Also had to install a mod to make animations play out faster, because half of your time is otherwise spent looking at the same few sprites that show up every time you make an interaction.The narrator is iconic though.",Negative
Darkest Dungeon,262060,"Great style and sound design, addictive loop but it failed to keep my interest toward the late game, dramatically.I can accept it's a game of rolling the dice and it can go both ways, I wish the game would accept that risk as well though, the later you get the more you have to lose and yet all the mechanics of the game bend the odds worse against you, the RNG is bent further against your favor with no benefit to you and the only way to keep up is equipment RNG, when the end game makes it very likely you will lose people it puts into perspective how much fun it is grinding a character back to max and rolling for the correct equipment to even give them a chance at success. Not to mention the rest of the team being functionally worthless until you train up a replacement for their comrade, since naturally as you get into the harder levels, less optimal strategies fall off in efficacy, though I do question the decision to make almost every status effect based team near useless by late game, starts to feel a lot like railroading. Not very fun, not at all. I'd go as far as to call it monotony. Whatever their goal with this game was I don't think it was boredom, yet that's about all the late game gives me, that and a desire to play anything else.",Negative
Darkest Dungeon,262060,"the games designed around getting you to waste time. at its core, the game needs some polishing. by default lots of enemies have med-high resists which hinder certain characters from being effective. tack on additional penalties in accuracy for every skill that isnt level 2-3 and you get what i'm talking about by wasted time.the creators lack the insight to design battles off solid numbers so they padded resists and misses in as rng. extended battles with high rng isnt satisfying gameplay and i cant find 1 redeeming quality that feels good",Negative
Darkest Dungeon,262060,"There is no hope, no hope at all in this hell...",Negative
Darkest Dungeon,262060,ridiculous mechanics could be better if the developers had brains and a will to live,Negative
Darkest Dungeon,262060,No support for ultrawide screen and no option to launch with border so you can move the window to one side.,Negative
Darkest Dungeon,262060,"Really good single player game ruined by multiplayer content and locking rewards in seasonal multiplayer events. It's really a shame, something that could be timeless was just made destined to be abandoned because of this.",Negative
Darkest Dungeon,262060,this game sucks,Negative
Darkest Dungeon,262060,"i don't recommend it, but i'll keep playing it",Negative
Darkest Dungeon,262060,"I get what it's going for, I can see where others might enjoy this... but it just feels annoying. Like, why would party members randomly fall out of formation? Your front guard would never find himself at the rear in IRL engagements... it's a game made to purposefully be tedious, and I honestly doubt I'll have more fun in an hour or two than I already have had.",Negative
Darkest Dungeon,262060,"Characters get heart attacks from wandering in the dark and they talk crap about each other during combat like that film with lindsey lohan mean girls. Its got good art and atmosphere though, get the god mode mod... The gameplay is prove yourself trash that punishes you for taking a step. Not worth 100 plus hours to figure out how to even get a foothold. Least there's mod support, I won't be buying the sequel had my fill.",Negative
Darkest Dungeon,262060,darkest dungeon? more like brightest dungeoncool game but wouldnt recommend playing it,Negative
Darkest Dungeon,262060,terrible for new players and no real help on it couse you play players who know what to do and its pvp with no fun in playing anything else,Negative
Darkest Dungeon,262060,This game really does not want me to enjoy playing it.,Negative
Darkest Dungeon,262060,Nope,Negative
Darkest Dungeon,262060,"Game runs at 4-8 FPS, Completely unplayable. Ryzen 5 3600, RX 5600, 48gb Ram",Negative
Darkest Dungeon,262060,Limited License EULA. No ownership.,Negative
Darkest Dungeon,262060,I don't care for the EULA.,Negative
Darkest Dungeon,262060,unsatisfying garbage that punishes you on every single step you make. DUMB!,Negative
Darkest Dungeon,262060,The grind is too much for me. Sadly won't be checking out Darkest 2 because of this.,Negative
Darkest Dungeon,262060,I bet they're glad they chose egs for the second game. RIP. Lmao.,Negative
Darkest Dungeon,262060,Nope,Negative
Darkest Dungeon,262060,darius made me post this,Negative
Darkest Dungeon,262060,"If you like pain and having to lose like 10 times in order to actually play the game, this is for you.",Negative
Darkest Dungeon,262060,"Even on easy, losing players in the second time out.  NOPE.  Goodbye",Negative
Darkest Dungeon,262060,I do not understand why this game is overwhelmingly positive when most people have not even beaten it.The visuals and audio is great. Gameplay? You're not really playing,Negative
Darkest Dungeon,262060,"Just too repetitive for me, and the reward of exploration is just more grinding",Negative
Darkest Dungeon,262060,rat game,Negative
Darkest Dungeon,262060,nerf the stress mechanic and then the game is fun,Negative
Darkest Dungeon,262060,"stress management was and is done better in dd2. it makes no sense and there's nothing to mitigate stress while in a dungeon. unfun rng basically just coin flip simulator. no thanks,",Negative
