Game,Game ID,Review,Review Type
Baldur's Gate 3,1086940,"This is just a fantastic game, with great game play and storytelling. I highly recommended playing this game.",Positive
Baldur's Gate 3,1086940,Brings new meaning to the words RPG,Positive
Baldur's Gate 3,1086940,"This is such a monumental achievement, there's not much I can say that hasn't already been said, but this game has made me feel things I haven't felt about video games in years. Incredible acting and well written characters, good for numerous playthroughs, I'm about 400 hours in and not even close to being sick of it.",Positive
Baldur's Gate 3,1086940,"very good, very nice , yes yes",Positive
Baldur's Gate 3,1086940,It's fun once you figure out how to battle. Quicksaves are the key.,Positive
Baldur's Gate 3,1086940,amazing game,Positive
Baldur's Gate 3,1086940,Fire,Positive
Baldur's Gate 3,1086940,goty,Positive
Baldur's Gate 3,1086940,I didn't understand anything at first. Luckily I had a friend help me through Act 1. Once you understand the gameplay it becomes really addicting. Act 1 alone has more content than most AAA games realeased in the last decade. Worth every cent. Even bought the DLC just to support the devs. I wish more devs would understand quality over quantity. This mentality brings in more customers in the long run imho.,Positive
Baldur's Gate 3,1086940,I have never ever had a single player game offer me so much variety. I can't tell how many times I started a new campaign. Yet still haven't made it through to the end of the game and only scraped the surface of Act 3. Will continue to support this game. This is by far the best game I have ever played.,Positive
Baldur's Gate 3,1086940,"Constant updates, endless branches to go about the story, it's just fun. Can't wait to see what else they add",Positive
Baldur's Gate 3,1086940,it's a masterpiece,Positive
Baldur's Gate 3,1086940,fun!!,Positive
Baldur's Gate 3,1086940,awesome rpg game,Positive
Baldur's Gate 3,1086940,Great game!!,Positive
Baldur's Gate 3,1086940,what more is left to be said after what others have said.  Great game,Positive
Baldur's Gate 3,1086940,2023 will be remembered as the year BG3 came out,Positive
Baldur's Gate 3,1086940,"I'm only in Act 2 and still finding hidden easter eggs. Great game, excited for a future play through.",Positive
Baldur's Gate 3,1086940,First time playing a game like this and so far I love it. I think this is what DnD is like but for people like me with no friends or time to make friends,Positive
Baldur's Gate 3,1086940,you can use short people as a throwing weapon,Positive
Baldur's Gate 3,1086940,because,Positive
Baldur's Gate 3,1086940,hot fruity wizard and hot fruity vampire,Positive
Baldur's Gate 3,1086940,"Genuinely the best single player game I have ever played. Last year I gave that title to Elden Ring and thought that title would stay there for a long time, but somehow this game has surpassed the fun I had on that.",Positive
Baldur's Gate 3,1086940,good,Positive
Baldur's Gate 3,1086940,What can I say that you don't already know - just buy the game,Positive
Baldur's Gate 3,1086940,great game,Positive
Baldur's Gate 3,1086940,Masterpiece,Positive
Baldur's Gate 3,1086940,obergeil .. you can play it multiple times and venture through completely different areas,Positive
Baldur's Gate 3,1086940,i can see the pee pee,Positive
Baldur's Gate 3,1086940,Great game,Positive
Baldur's Gate 3,1086940,good game,Positive
Baldur's Gate 3,1086940,"Complete game, no microtransactions, free updates. Money well spent.",Positive
Baldur's Gate 3,1086940,I have far too many hours,Positive
Baldur's Gate 3,1086940,Hands down best game i've ever played in a very long time.,Positive
Baldur's Gate 3,1086940,Best RPG.,Positive
Baldur's Gate 3,1086940,Is game that is like other games but better than almost all games so yes play game,Positive
Baldur's Gate 3,1086940,"It has already been written 1000 times.One of the best games I've played in a long time, with a great story and an absurd amount of little details.Almost 200 hours after my first co-op playthrough and with many more to come!",Positive
Baldur's Gate 3,1086940,The best CRPG game i have yet to play.,Positive
Baldur's Gate 3,1086940,"Been following bg3 since it the beta came out.Simply a amazing game, best one I've played in ages",Positive
Baldur's Gate 3,1086940,sexy and slurpage,Positive
Baldur's Gate 3,1086940,gg,Positive
Baldur's Gate 3,1086940,Easily one of the best games i've ever player a worthy successor to a legendary Ip!,Positive
Baldur's Gate 3,1086940,"wow, very good game, would recommend",Positive
Baldur's Gate 3,1086940,Once in a life time game,Positive
Baldur's Gate 3,1086940,I want Astarion to suck something out of me hard......and no I'm not talking about blood,Positive
Baldur's Gate 3,1086940,if you like dnd this game is for you,Positive
Baldur's Gate 3,1086940,awesome game. If you liked Divinity series this is a big step up,Positive
Baldur's Gate 3,1086940,Good,Positive
Baldur's Gate 3,1086940,video games,Positive
Baldur's Gate 3,1086940,Can't recommend this enough. Bravo Larian.,Positive
Baldur's Gate 3,1086940,gud,Positive
Baldur's Gate 3,1086940,"A once-in-a-decade kind of gaming experience. The amount of passion, ambition, storytelling, and attention to detail that Larian has put into this game is staggering. Yes, there are bugs, the inventory system is not great, and it has many other things that could have been better. But these flaws are nowhere near sufficient to make me consider this as anything less than a masterpiece.",Positive
Baldur's Gate 3,1086940,love it to play with my friendsone is an orc monk who has the most gold of alland one is a gnome wizard who dies first beecause his positioning is the worst,Positive
Baldur's Gate 3,1086940,so good,Positive
Baldur's Gate 3,1086940,Love it,Positive
Baldur's Gate 3,1086940,Goodest game,Positive
Baldur's Gate 3,1086940,good,Positive
Baldur's Gate 3,1086940,I haven't had this much fun in years.,Positive
Baldur's Gate 3,1086940,I love all Larian's masterpieces. Thanks Larian.,Positive
Baldur's Gate 3,1086940,its a must man this game was a blast didnt even noticed that i player 62 hours on my first run  the game is hella huge.The character are so well written and the acting is on point karlach quest line was a gut punch mani love shadowheart and did the best possible ending with herjk simmons came for a brief moment and he was hella dopebg3 deserves all the hype and the love it gets and easily i consider it game of the year,Positive
Baldur's Gate 3,1086940,Play the gosh darn game!,Positive
Baldur's Gate 3,1086940,I wish Astarion was real.,Positive
Baldur's Gate 3,1086940,banger,Positive
Baldur's Gate 3,1086940,"It's probably the best game ever made. Up there with Total Warhammer 2, Dark Souls, Skyrim",Positive
Baldur's Gate 3,1086940,I love it!,Positive
Baldur's Gate 3,1086940,Only one problem. It's ended.,Positive
Baldur's Gate 3,1086940,Very good I like that I can wear a silly hat,Positive
Baldur's Gate 3,1086940,most in depth hardcore rpg I have ever played.,Positive
Baldur's Gate 3,1086940,i liked boinking the bear,Positive
Baldur's Gate 3,1086940,yes half elves are hot,Positive
Baldur's Gate 3,1086940,"It is just dnd, witch is awsom",Positive
Baldur's Gate 3,1086940,Objectively the most well-crafted game ever developed.,Positive
Baldur's Gate 3,1086940,pretty neat so far,Positive
Baldur's Gate 3,1086940,"I had never played this kind of game before, but I saw content online and couldn't resist trying it- I don't regret anything! There's so much to be found, so many secrets and storylines, and the most unique interesting characters. I took a while to leave a review because I just had no idea how to sum up what I thought of the game into a small enough message. It's great to just take the game in at your own pace, see where it takes you!",Positive
Baldur's Gate 3,1086940,Scratch is the goodest boy and I want mama K to step on me.One of the best games I have ever played.,Positive
Baldur's Gate 3,1086940,Redefines what a AAA should be while being from an independent company.,Positive
Baldur's Gate 3,1086940,Amazing another of content very fun,Positive
Baldur's Gate 3,1086940,not bad,Positive
Baldur's Gate 3,1086940,It's so good.,Positive
Baldur's Gate 3,1086940,"The depth, the overall polished game, it's a masterpiece",Positive
Baldur's Gate 3,1086940,goty,Positive
Baldur's Gate 3,1086940,Is gud.,Positive
Baldur's Gate 3,1086940,Dragon age origins but modern. Very good!,Positive
Baldur's Gate 3,1086940,"for my first game, best game ever",Positive
Baldur's Gate 3,1086940,Game good,Positive
Baldur's Gate 3,1086940,"I romanced a lizard, a locomotive, a squid,a suicide bomber, a blood sucker, a dragon lady. oh and i guess i saved a city or something. awesome dating sim with some cool adventure aspects of it. dont forget to pet both of the good boys whenever you can.",Positive
Baldur's Gate 3,1086940,Great,Positive
Baldur's Gate 3,1086940,"must have a decent PC and I would say its funner solo, but an overall great game unlike any other.",Positive
Baldur's Gate 3,1086940,Best game ever played,Positive
Baldur's Gate 3,1086940,is good,Positive
Baldur's Gate 3,1086940,"Frankly a work of art. We didn't deserve this - an incredibly complex, layered piece of software that does an incredible job of letting people explore a world and a story.",Positive
Baldur's Gate 3,1086940,One of the best ever. Stop reading reviews and buy this game.,Positive
Baldur's Gate 3,1086940,Great story. took a little bit to understand game mechanics but overall a great game.,Positive
Baldur's Gate 3,1086940,sue,Positive
Baldur's Gate 3,1086940,im gay,Positive
Baldur's Gate 3,1086940,Awesome Game.,Positive
Baldur's Gate 3,1086940,The game will not run. It locks up before you even get to the main menu screen. And you won't be given a refund so buyer beware.,Negative
Baldur's Gate 3,1086940,"Roll a dice, reload save, die and reload simulator 2023",Negative
Baldur's Gate 3,1086940,In this game you fighting not monsters but game bugs. It crashes so much that it's absolutely unplayable.,Negative
Baldur's Gate 3,1086940,"Product received for freeNo character is likeable. All ""party"" members threaten you and demean you out of the gates. All characters are written to be as unlikable as possible. The only likeable character in this game is the old racist lady outside the Gith camp. Id rather wipe my ass with poison oak.",Negative
Baldur's Gate 3,1086940,"Complete trash.Die over and over on the easiest setting not far into the game.On that type of setting I should not have to worry about death, I should be able to enjoy the storyline and feel like my character is a god.",Negative
Baldur's Gate 3,1086940,By patch 5 i still am facing major bugs that make the game almost unplayable. I want to love it but cant. i know am probably in the minority of players but oh well.,Negative
Baldur's Gate 3,1086940,Like and React this review to turn Positive,Negative
Baldur's Gate 3,1086940,Until you remove the political face of lunatics from the front page you will not have a good review from me.,Negative
Baldur's Gate 3,1086940,"Broken game, can't load saves, killed it with updates that make it unusable.  Act III can't even load saved games now",Negative
Baldur's Gate 3,1086940,Game stinks. I'm a barbarian and I wanna fight enemies hack and slash you know good fun stuff instead every enemy is out of reach. Some enemies like the stupid spider Teleports all around the map.  So I'm sitting there with a barbarian trying to kill an enemy while I hit them with my crossbow for two points.. Game stinks can I just fight an enemy and not Just chase them around the map,Negative
Baldur's Gate 3,1086940,"It's so buggy it's literally unplayable.I've tried to play this game numerous times, but I just can't. After the recent update, I decided I'd give it another try, but I can't get beyond the starting beach. Saves didn't work, and I kept crashing. I tried reinstalling the game, and after multiple crashes during character creation, I was able to start a new game. Saving still didn't work, and it eventually crashed so hard that my computer restarted. This game is a mess. If anyone has a solution to creating a character, saving, or exploring the starting beach all not working, I'd love to hear it.",Negative
Baldur's Gate 3,1086940,This game was fantastic until Act III and the story.  The story arc in Act III completely ruined the game for me and I couldn't finish because it literally took the fun out of it.  You can literally compare these decisions like voting for the last 2 presidential elections.   You have the option between a douche and a poop sandwich.,Negative
Baldur's Gate 3,1086940,Boring,Negative
Baldur's Gate 3,1086940,no fishing minigame,Negative
Baldur's Gate 3,1086940,"The game itself is pretty good, however I myself only play once a week, and it seems the patches are very often, and each patch is over 100g each time to update, this makes it such a pain to actually bother playing, so, unless you're going to be playing it everyday then don't bother until they're done patching all the time.",Negative
Baldur's Gate 3,1086940,"I really hate to give it a thumbs down and would love to recommend this game, but sadly this recent patch has made it insanely unplayable. Dice rolls feel terrible out of nowhere now? The graphics don't even look good anymore, screen tearing, blurriness, it looks bad since I last played it. I don't know what is going on with this game, also people are saying in Act 3 it get EVEN WORSE than it is in 1 and 2 that is wild lol. Great game that fails at the sake of optimization, and it not being finished.",Negative
Baldur's Gate 3,1086940,wow.... Not gud,Negative
Baldur's Gate 3,1086940,dog water game cant make shrek,Negative
Baldur's Gate 3,1086940,Extremely overhyped average game.,Negative
Baldur's Gate 3,1086940,combat is rancid,Negative
Baldur's Gate 3,1086940,too long,Negative
Baldur's Gate 3,1086940,"for a game praised for it's expansiveness, ballings gate 3 really fails at creating a single character that doesnt look like some 60 year old mf youd find at a walmart in arkansas",Negative
Baldur's Gate 3,1086940,"Probably great if you're in it for the story. If you're in it for the combat, pick DOS 2 instead.Limited choices to make once in combat because the interesting options are time-locked to not be used often.The mechanics are largely based on dice rolls, making the game a poor fit for those who find joy in careful planning.",Negative
Baldur's Gate 3,1086940,download resets every time I pause it can't play the game..,Negative
Baldur's Gate 3,1086940,GARBAGE!!! GARBAGE!!! GARBAGE!!! GARBAGE!!! GARBAGE!!! GARBAGE!!! GARBAGE!!! GARBAGE!!! GARBAGE!!! GARBAGE!!! GARBAGE!!! GARBAGE!!! GARBAGE!!! GARBAGE!!! GARBAGE!!! GARBAGE!!!,Negative
Baldur's Gate 3,1086940,"This game would rather involve two characters in a sex scene than actually focus on character development between said characters. If you want to shallowly fill a sexual fantasy of yours then sure, it's great. If you prefer a legitimate RP experience, then you're gonna be sorely disappointed",Negative
Baldur's Gate 3,1086940,"The save system on this game combined with Nvidia GeForce makes it an experience that is impossible to enjoy.  I've had to replay most of the game between Geforce kicking me off without saving, the game glitching and characters dying from jumping off ledges where they become unresurectable and you have to go back to the last save. Do not get this game or Nvidia GeForce.  The amount of time GeForce has cost me could pay for a new computer.",Negative
Baldur's Gate 3,1086940,the bugs in this game are critical and playthrough breaking. often the game just doesnt want to function properly.every single run up until this point was connected to a character. the first time it was omeluum and the second time it was halsen. doesnt even matter which form. all of them bugged out the game and even cutschenes bugged out. items arent working in certain combinations etc.I did love the rest of the game. but I wish it worked better,Negative
Baldur's Gate 3,1086940,"Overall good game, but the Netherbrain fight is so genuinely terrible it has killed my desire to play the game any further knowing that's what I have to deal with at the end of the road.",Negative
Baldur's Gate 3,1086940,"Another day, another overrated game",Negative
Baldur's Gate 3,1086940,while the game is a lot of fun to play i find it incredibly hard to play together with my friends due to one of them playing on mac of which the version is not in sync with the windows one.,Negative
Baldur's Gate 3,1086940,Can't save. error code 701,Negative
Baldur's Gate 3,1086940,"The lag and cut-scene delays are atrocious in the end of Act II and all of Act III. Game is completely unplayable. Whoever voted for this as Game of the Year clearly never made it this far into the game. Too bad, it was a great game until those points.",Negative
Baldur's Gate 3,1086940,System won't let me play,Negative
Baldur's Gate 3,1086940,"throw flaming sword at explosives, doesn't explode... uninstalled",Negative
Baldur's Gate 3,1086940,woof woof,Negative
Baldur's Gate 3,1086940,"The menu and inventory is a bloody nightmare, everythings so slow and sluggish, no ez vendor system. The weopons are pretty sub par nothing really exciting. Everyone tries to have intercourse with you everytime u talk to someone. The game is disgusting. Wont be playing another game from this studio ever again.",Negative
Baldur's Gate 3,1086940,"Good game, but CRITICAL MISS",Negative
Baldur's Gate 3,1086940,This game is excellent but its way too buggy when you reach the 3rd act,Negative
Baldur's Gate 3,1086940,It's obvious but don't play this if you don't like single player games.,Negative
Baldur's Gate 3,1086940,"I. should. not. have. to. allocate. an. entire. hard. drive. worth. of. space. just. to. update. a. game. O.OI had plenty of space to update, yet it wouldn't. I even tried uninstalling a few small games that I hardly play. No joy! Instead, here I am, uninstalling and reinstalling the game to a different drive to play with friends later tonight. If it weren't for the friends, I wouldn't bother at all. That's how annoying it is.",Negative
Baldur's Gate 3,1086940,"I have never played a game with so many issues from the start of playing, constantly kicked from game means I had to make sure to save every 5 miniutes or spend time doing things more than once, Loved Baldurs gate 1 and 2 but wish I had never purchased 3.",Negative
Baldur's Gate 3,1086940,"Non stop crashes. 2 hour long patch updates. And every crash requires the game to recheck files, at least 60 minutes. You'll be wondering what's wrong with this game more than you actually get to play it. Its infuriating because if it wasn't so shoddily run it would be amazing.",Negative
Baldur's Gate 3,1086940,"Another f-ing 30gb patch and it takes ages to install even on a SSD, you want to shorten your SSD lifespan really fast? BG3 is the game.",Negative
Baldur's Gate 3,1086940,"Not being able to play for 10 days because Steam wants to do an update, sucks!!! Buy the game yourself, don't download it.",Negative
Baldur's Gate 3,1086940,"They patch out Having good Wyll and Karlach. Wyll quest wont update when you kill Katlach and once her head been remove you cant revive her, even with true resurrection.",Negative
Baldur's Gate 3,1086940,crash.  look another crash... look another.,Negative
Baldur's Gate 3,1086940,"Its a boring game for people with a boring imagination.  It does what it does at a top tier, bedazzling the slack-jaw.  When I talk to gamer friends at work, no one has actual memories of the game.  Shallow, but hey, you can see the pores of your party.  Have fun racking up hours of duh.",Negative
Baldur's Gate 3,1086940,They completly broke the 5e Action Economy. Solasta did a far better implementation.,Negative
Baldur's Gate 3,1086940,"Baldur's Gate 3 delivers an immersive and engaging experience with its captivating storyline and rich characters. However, the ending falls short, and in a way that left me disappointed.",Negative
Baldur's Gate 3,1086940,the rules and premise are great the game play is eh i find the ai to be stupid they just run into lava when they have a completely clear path. after patch 5 my game has crashed repetitively and before that patch i couldnt even play act 3. fix your game,Negative
Baldur's Gate 3,1086940,"The game is wonderful, they have done a great job, the changes made to Wyll in patch 5 were not asked for nor should they be mandatory.  No point in playing a game and having the developer make unnecessary and unwanted changed to the game midway through play.",Negative
Baldur's Gate 3,1086940,"Product received for freeI can run the game on ultra at over 100 FPS, but the constant crashes shutting down my system are a huge pain. I spent as much time troubleshooting this problem as I have playing the game. Its not a hardware or driver issue, only happens to t his game. This really needs to get fixed.",Negative
Baldur's Gate 3,1086940,I like the game. Its one of the best games that I've played in the last years. Still I refuse to give a proper review since I am just annoyed by the game starting updates whenever it wants even though I've set steam to not do updates without my permission. Furthermore the update process on this game works just very poorly. So from a technical aspect this game is a total no-go!,Negative
Baldur's Gate 3,1086940,"I have a few hours in the gameI would not recommend this game if you are playing with friends that are not om the same platform as you though.So many hours wasted and so many scheduled sessions having to be canceled at the last moment because of this.Larian can't figure out how to keep the same updates on all platforms, even though they pride themselves on being a co-op game",Negative
Baldur's Gate 3,1086940,it's ok i guess,Negative
Baldur's Gate 3,1086940,Frustrating.,Negative
Baldur's Gate 3,1086940,I bought this game with my friend. We can never play it. Every time we go to play there is a new 6 hour update.Its already 120gb and it needs 26 gb patches that take hours to install? Every week. Go away.,Negative
Baldur's Gate 3,1086940,It would have been nice to get a sequel to the Baldur's Gate games instead of an XCOM and Dragon Age love child.,Negative
Baldur's Gate 3,1086940,"Mediocre, Morsov.",Negative
Baldur's Gate 3,1086940,"It is probably a good game, but not for me.The graphical style is childish and i don't like the combat system.",Negative
Baldur's Gate 3,1086940,"I really do not like this game. The Character creation is bad, the optimization is horrible and the gameplay is a snooze fest.",Negative
Baldur's Gate 3,1086940,"Too much talking, hardly any fighting.It is well done though if that is your thing.",Negative
Baldur's Gate 3,1086940,this would be a good game if it didnt crash every 20 minutes,Negative
Baldur's Gate 3,1086940,"This is gonna be a hard one. I'm about 520 hours into this game and done many playthroughs. The release of this game, and the quality at release was AMAZING. This game absolutely blew me out of the water like literally no game ever has, or ever will again. The story, sheer amount of detail, and character romance stories are unparalleled  by anything that has come before, and the immersion was as well before the last update. The combat was also innovative and incredible. However, due to the damage of the last two updates, I can only recommend that people save their money and not bother for a long while. The last update before today broke the combat and made act 3 virtually unplayable, with the party freezing and you being unable to interact with anything for anyone for anywhere between 5 and 20 minutes, and this would happen every 10 yards if travel, often even less. And mind you this is with a badass PC and no mods. Making choices throughout the game was proven to slow down performance, and that speaks to a much deeper problem with the game's design that must be fixed before it will be worth playing again. Today's update completely destroyed the game. Any attempt to play the game- whether trying to load an old game or start a new one- will result in an immediate crash to desktop. I've tried reinstalling the game and nothing has worked. After how much I grew to love this game over the first 350 hours of gameplay, this is devastating and hurtfull, as well how insulting the last 150 hours felt with the game being broken from the last update. I hope one day the devs will figure out what the hell theyre doing, because I've never seen a game go from amazing to unplayable, only the other way around. Save your money and dont buy this until it's fixed. If they can ever restore the game to its former glory, I'll change my review. But dont waste your time and money on this just yet if you haven't already",Negative
Baldur's Gate 3,1086940,The game is fun enough until you get to ACT 3.  OMG the game is almost unplayable.  The loading lags are minutes long to take a few steps.  In it's current state i can't recommend it.  There's no reason this game was released with this kind of bug.  How is this GoTY material?!,Negative
Baldur's Gate 3,1086940,The game is broken and full of bugs on PC and PS5.  The latest patch made the game unplayable.  Save your money until Larian Studios decides to fix it.,Negative
Baldur's Gate 3,1086940,"Game crashes my Computer after 30minutes of play time. Looked online for help, its been happening to hundreds of people. We need a fix for this. Would be a great game if not for this issue hope they fix it soon",Negative
Baldur's Gate 3,1086940,Baldur's Gate lll is just not my cup of tea.,Negative
