Game,Game ID,Review,Review Type
Cyberpunk 2077,1091500,COOK,Positive
Cyberpunk 2077,1091500,I started playing after all of the big updates.  Easily one of my favorite games hands down.,Positive
Cyberpunk 2077,1091500,"This game is great, updates have made it the game it was meant to be.",Positive
Cyberpunk 2077,1091500,2.1 and Phantom Liberty Turned the game around,Positive
Cyberpunk 2077,1091500,They did it. After few years of repairing and fixing game is in great shape. I enjoyed every minute of my second replay.,Positive
Cyberpunk 2077,1091500,"This game brought tears to my eyes and it helped me through my divorce with my wife, she took the kids but that's OK Judy is the love of my life. It taught that friends are what matter most in this world and that corporations care little for the precious life of people if it fills up their pockets",Positive
Cyberpunk 2077,1091500,This game is amazing and CDPR supports the game with new updates,Positive
Cyberpunk 2077,1091500,One of the rare occasions in modern gaming where a AAA game is actually great. A diamond in a sea of sewage.,Positive
Cyberpunk 2077,1091500,very good,Positive
Cyberpunk 2077,1091500,fun game,Positive
Cyberpunk 2077,1091500,"this game is so nice that i can not stop to play it.it makes my faking life so much better.Cyberpunk 2077,the eternal god!",Positive
Cyberpunk 2077,1091500,Wow,Positive
Cyberpunk 2077,1091500,the best cyberpunk story,Positive
Cyberpunk 2077,1091500,2.0 update turned my opinion around. Great comeback from abysmal launch,Positive
Cyberpunk 2077,1091500,amazing,Positive
Cyberpunk 2077,1091500,ok,Positive
Cyberpunk 2077,1091500,Just finished the game and already looking forward to the second playthrough.One o the best RPGs ever.,Positive
Cyberpunk 2077,1091500,goooooooooooooooooooooooooooooooooooood,Positive
Cyberpunk 2077,1091500,"Even if the game already has a decent amount of contents that are worth the price, in my opinion the potential of NC setting, storytelling is not fully realized yet. You can feel many contents are cut out in an unnatural way. Moreover the gameplay can be further polished.I hope they get the money they want to do better at their next game, take their time to achieve something like Rockstar's games.",Positive
Cyberpunk 2077,1091500,future game,Positive
Cyberpunk 2077,1091500,Neon lights are pretty,Positive
Cyberpunk 2077,1091500,bloody good,Positive
Cyberpunk 2077,1091500,"My friend I play with said that if I post a review about the game and it gets 200 likes and 50 rewards, he'll buy me a bag of chips and a RTX 4090. So I'll leave this here.",Positive
Cyberpunk 2077,1091500,we're so back its not even funny,Positive
Cyberpunk 2077,1091500,"I can say now, three years later worth of patches and fixes, the game is good, worth the price",Positive
Cyberpunk 2077,1091500,Best game I've played in years.,Positive
Cyberpunk 2077,1091500,A lot of the original issues are fixed. Very much enjoying this one!,Positive
Cyberpunk 2077,1091500,"Don't know what it was like at release, but with a good PC the graphics are pretty amazing and it runs well. The story is fun, the characters you meet along the way feel like actual people, and their stories are good too. This is a top tier FPS-RPG. The only thing I want is more. More DLC, more Panam!",Positive
Cyberpunk 2077,1091500,Its Pretty neat now. wait till the ultimate edition is out tho.,Positive
Cyberpunk 2077,1091500,game gud game fun,Positive
Cyberpunk 2077,1091500,"never stop fighting, v",Positive
Cyberpunk 2077,1091500,I like this game. I think it's fun.,Positive
Cyberpunk 2077,1091500,"Dawg, play this game",Positive
Cyberpunk 2077,1091500,"Playing through again with Phantom Liberty.  The restructuring of progression, vehicle unlocks, and general pace are much better.  Lots of side activities to explore.  Am loving the revamp.  If you are really into exploring the whole world, there's a lot here to do and see now.",Positive
Cyberpunk 2077,1091500,SANDY GO BRRRRRRRR!!!!,Positive
Cyberpunk 2077,1091500,Cybersex,Positive
Cyberpunk 2077,1091500,Glad the game is fixed. Amazing world.,Positive
Cyberpunk 2077,1091500,It is great.,Positive
Cyberpunk 2077,1091500,"One of the best games in modern history! Playing through a 2nd time and with the DLC makes this game almost perfect with all the updates done to it. Also, the modding community make this game something really special!",Positive
Cyberpunk 2077,1091500,"When it came out, the game definitely wasn't what was promised, but I honestly liked it. It was a buggy mess but still kept me interested. Now it's fantastic. There are still some bugs, but nothing big in my experience. The performance on launch day and now are like day and night. Nice recovery CDPR!",Positive
Cyberpunk 2077,1091500,"It was a glitchy, buggy mess at release. Now, it's not too bad. It was a pretty fun game but it felt rather short.",Positive
Cyberpunk 2077,1091500,I enjoyed the game!,Positive
Cyberpunk 2077,1091500,discombobulate,Positive
Cyberpunk 2077,1091500,Best Game. now that everything is fixed!,Positive
Cyberpunk 2077,1091500,yes,Positive
Cyberpunk 2077,1091500,"playing this game since launchthis game is like kid, first it's annoying and funny then it makes you proudit wasn't the game we were promised but it is the game we wanted",Positive
Cyberpunk 2077,1091500,great game,Positive
Cyberpunk 2077,1091500,"Gotta say, I first played this game upon release, one of the worst experiences I ever had with a game, but now that I've been replaying it, this is the experience I wanted. They truly brought it back from the grave, loving going back through and taking my time, as i sped through last time since I hated it so much. They did a good job, and im excited to get phantom liberty after I finish the main story!",Positive
Cyberpunk 2077,1091500,Brilliant.,Positive
Cyberpunk 2077,1091500,Literally the gift that keeps on giving. It started out funny then slick became the  best game of this generation.,Positive
Cyberpunk 2077,1091500,"Story is great so far, just finished prologue and interlude",Positive
Cyberpunk 2077,1091500,"Bought the game when it 1st released on ps4 and man the issues were absolutely terrible as we all know, recently decided to get it on steam and for the price I wasn't disappointed one bit. The fact they added bits of the anime edgerunner series into the story just made the already amazing story that much more entertaining. Would honestly play another 50h in this game just to explore all I missed on my 1st playthrough.",Positive
Cyberpunk 2077,1091500,"don't listen to people that still complain about this game back in it's release, the game is great now!",Positive
Cyberpunk 2077,1091500,"I waited 13 years for this game. I played through it since release. There were so many flaws at first, but still a very charming gem. Nowadays with the patches, the game is living up to its potential.",Positive
Cyberpunk 2077,1091500,i like it,Positive
Cyberpunk 2077,1091500,All the updates since launch are great additions. Am re-hooked on this game,Positive
Cyberpunk 2077,1091500,Cyberpunk is out of beta! Took a couple years but it was worth the wait.Awesome game.,Positive
Cyberpunk 2077,1091500,Banger.,Positive
Cyberpunk 2077,1091500,"Map is big and detailed, but it's not beautiful. It's dirty.Fast travel is convenient and vehicles are fast.Can be played by just focusing on the main story quests and ignoring all the tedious side job quests.Since it's a rpg, the FPS game play is not satisfying and bosses are bullet sponges. Stealth is terrible.Everyone runs away when you punch in the air.There are no flying cars.The tutorial is long and boring.",Positive
Cyberpunk 2077,1091500,"The 2.0 Update and Phantom Liberty are what the game should've been on release and they've definitely won back the respect and good faith. PL is amazing and so is the new 2.0 update, been LOVING the game. Thanks CDPR",Positive
Cyberpunk 2077,1091500,pretty good,Positive
Cyberpunk 2077,1091500,You can see titties,Positive
Cyberpunk 2077,1091500,keanu reeves will not leave me alone and is trying to make me a terrorist,Positive
Cyberpunk 2077,1091500,"I like this game it is good. sometimes its better than good, some times it makes me feel a little funny in my pants",Positive
Cyberpunk 2077,1091500,They fixed it.,Positive
Cyberpunk 2077,1091500,Love everything about this game. Really hope they add more quests stories and missions,Positive
Cyberpunk 2077,1091500,Good game,Positive
Cyberpunk 2077,1091500,"One of the best games I ever played.The basegame is fantastic, and Phantom Liberty only adds on more excellent content. The bugs are -mostly- gone, and the rare ones that show up more or less make me go ""haha, that's stupid"" instead of being frustrating.I am very picky about the games I play, and a rare few treasures capture me like Cyberpunk did. I can't recommend it enough.",Positive
Cyberpunk 2077,1091500,great story line and game play,Positive
Cyberpunk 2077,1091500,Tig Ol Bitties.,Positive
Cyberpunk 2077,1091500,The game works great after the patch.,Positive
Cyberpunk 2077,1091500,good game,Positive
Cyberpunk 2077,1091500,Amazing,Positive
Cyberpunk 2077,1091500,good,Positive
Cyberpunk 2077,1091500,immersive,Positive
Cyberpunk 2077,1091500,Product received for freeStarted out rocky but I fell in love with this story.,Positive
Cyberpunk 2077,1091500,"Absolute turn around with 2.0. I had to uninstall the game, it was straining my marriage from me playing so much.",Positive
Cyberpunk 2077,1091500,best game ever,Positive
Cyberpunk 2077,1091500,This game is extremely immersive. CDPR has outdone themselves. It took them 3 years after release but they got there and it was worth the wait,Positive
Cyberpunk 2077,1091500,bobs,Positive
Cyberpunk 2077,1091500,"It's good to know that after the 2.0 update, Cyberpunk 2077 has finally released. Solid game, good story and gameplay. It IS resource-intensive so make sure you're up to spec, otherwise enjoy.",Positive
Cyberpunk 2077,1091500,More addicting than cigarettes and literally just keeps getting better and better with each update.The only reason why this game was unfinished at launch is because CDPR was unable to code fast enough with one hand. For some reason all productivity came to a screeching halt after CDPR finished Panams character model.,Positive
Cyberpunk 2077,1091500,Un-modded experience is polished and clean. Feels intuitive and complex at the same time. Allows for multiple story paths even within each start path. Can't wait to try the game modded and would recommend for 'must have' shelf for any gamer.,Positive
Cyberpunk 2077,1091500,"Enjoyed the game a lot. Always enjoyed action games. The story can be very emotional, but the player choice and romance stories are iffy. I use a bunch of mods to help with game loading and it still runs slow a lot, but the game itself is pretty good.",Positive
Cyberpunk 2077,1091500,very good punk thank you punk,Positive
Cyberpunk 2077,1091500,very interesting storyline and characters  and amazing character interaction and choices,Positive
Cyberpunk 2077,1091500,good updates,Positive
Cyberpunk 2077,1091500,I love the concept and the playing of this game,Positive
Cyberpunk 2077,1091500,I can't stop spending money on brain dances,Positive
Cyberpunk 2077,1091500,IM CYBERPUUUUNNNKKKIIIIINNNNGGGG AAAAAAAHHH,Positive
Cyberpunk 2077,1091500,good game,Positive
Cyberpunk 2077,1091500,glowing rims,Positive
Cyberpunk 2077,1091500,Fun game to run around and play,Positive
Cyberpunk 2077,1091500,Best game ever! 358 hours actually playing the game.,Positive
Cyberpunk 2077,1091500,"Great game, really enjoying the improvements made since launch, looking forward to eventually playing the DLC.",Positive
Cyberpunk 2077,1091500,was bad now good kinda still needs to be fix,Positive
Cyberpunk 2077,1091500,They Fixed it. It is now quite good,Positive
Cyberpunk 2077,1091500,YES,Positive
Cyberpunk 2077,1091500,"Female V got pp, man happy female happy",Positive
Cyberpunk 2077,1091500,"poor attention to detail, game still feels like its in beta stage",Negative
Cyberpunk 2077,1091500,"This game is Somewhat broken. If you side with So Mi they lobotomise you. If you don't you get killed endlessly by an unkillable robot. Either way, you're out midgame.",Negative
Cyberpunk 2077,1091500,mid,Negative
Cyberpunk 2077,1091500,"This game controls like the product of an aspiring solo developers first FPS game made in unity, which is to say, it controls like hot garbage from 2001. Halo CE had better gameplay over 20 years ago. To say this has disappointed me would be a massive understatement and I resent the fact that the tutorial was JUST long enough that I can't refund the game.",Negative
Cyberpunk 2077,1091500,"Game is a hot mess,fix your game before telling people you've done a big update.MY GAME FLATLINED AS SOON AS JOHNNY GETS CAPTURED AFTER BOMBING ARASAKA,MEETING THE OLD MAN. MUTIPLE TRYS AND I CANT GET TO NEXT LEVEL FIX YOUR DAMN GAME PLEASE",Negative
Cyberpunk 2077,1091500,This game is boring not worth your money,Negative
Cyberpunk 2077,1091500,"nah men, been almost 3 years since release and this thing is still infected with bugs. Kinda ruined my experience.",Negative
Cyberpunk 2077,1091500,"Somewhat Damaged is appalling, made me uninstall the game",Negative
Cyberpunk 2077,1091500,2.0 Update completely deleted my ultimate quickhack netrunner build.  Glad that CDPR decided to nerf playstyles in a single player game.My disappointment is immeasurable and my day is ruined.,Negative
Cyberpunk 2077,1091500,"Awful performance and annoying sound bugs in 2.0, unplayable at this point",Negative
Cyberpunk 2077,1091500,Too many bugs,Negative
Cyberpunk 2077,1091500,buggy,Negative
Cyberpunk 2077,1091500,"I bought this on sale, and was shocked to see the amount of glitches in this game. You'll turn down a street and see half-rendered polygons walking around. After a few moments they materialize and then you see every person on the street is the exact same NPC lol. Cars randomly explode in the sky, you turn around and all-of-a-sudden 50 people spawn screaming and running, people make the ""T"" shape and hover around. I thought these were problems with the game on release, not after the most recent patching. That and the loading screens make it hard to play.",Negative
Cyberpunk 2077,1091500,"The game was great until the 2.0 patch which completely ruined and re modified the character builds.    I have over 300 hours of game play with my two characters built perfectly.  Then, when patch 2.0 hit, it completely reset them and changed everything about them.  This is a single player game, not an mmo.  Resetting people's characters for no damn reason is not a good way to keep players playing when they have hundreds of hours invested in their character that were built a certain way and learned how to play the game that way for hundred of hours.   I understand patching can be a good thing for bugs, AI, NPC's, environmental etc, but resetting people's character builds is f'ed up.",Negative
Cyberpunk 2077,1091500,Game is still riddled with bugs,Negative
Cyberpunk 2077,1091500,Product received for freeGame is great but the game is still not fixed after 2 years. Constant crashes and game breaking glitches,Negative
Cyberpunk 2077,1091500,Expansion is hours of scripted sandboxed obnoxious and frustrating puzzles and bosses.  Would not recommend.,Negative
Cyberpunk 2077,1091500,"I cannot recommend this game, at least for Steam deck. While the story and gameplay are okay, the game simply won't run functionally on the steam deck without regularly crashing after an hour or so. The deck simply can't handle running it without overheating quickly, at which point it becomes unplayable. The frame rate in general doesn't hold steady to 30FPS too well, but it's smooth enough to play for that first hour. I wouldn't recommend buying it for the steam deck unless you only want to play for an hour at a time.It's like GTA but with some future tech RPG skill elements. Overall it's okay.",Negative
Cyberpunk 2077,1091500,"The game is still broken for many people. I cannot even launch the game without it crashing. I have not played a single second, and have spent more than a few hours just trying to get it to launch. CDPR is a joke, and their customer support is nonexistent. Maybe its worth a shot if you can play it, but if its crashing at launch, save yourself the time and effort and just get a refund.",Negative
Cyberpunk 2077,1091500,non playable,Negative
Cyberpunk 2077,1091500,3  years later and this game is still completely garbage lol its just garbage in 4k now.,Negative
Cyberpunk 2077,1091500,GAME BREAKING GLITCHES STILL EXIST. PLAY AT YOUR OWN RISK.,Negative
Cyberpunk 2077,1091500,Locked key binds and no toggle aim. Refunded for the second and final time.,Negative
Cyberpunk 2077,1091500,Game Keeps crashing then you will get a error message saying game has flatlined with no fix..This is why i hate and never truss updates,Negative
Cyberpunk 2077,1091500,"This is a beautiful looking game with fantastic storytelling and gameplay. Unfortunately, after 25 hours the game now crashes everytime I have tried to load a save.",Negative
Cyberpunk 2077,1091500,"Even after being out for 3 years this game is still too buggy to play.  I love the world and the creative team did a great job but the game was really let down by the programming department.  I've run into multiple game ending bugs as well as a plethora of smaller bugs.  It's really frustrating trying to figure out what you're doing wrong in a mission and then after doing research on the internet you find out that the quest has just been bugged from release day and it's still not been fixed.  And that was one of the tutorial missions. ""Luckily"" they let you skip the tutorial but now I'm wishing they hadn't because I would have returned the game at that time and not spent hours slogging through the buggiest release I've ever played.",Negative
Cyberpunk 2077,1091500,Game is fun when it works but its buggy as hell. 3 years later and cant finish story line due to the phone bugging out.,Negative
Cyberpunk 2077,1091500,I like it but it corrupt my saves to often,Negative
Cyberpunk 2077,1091500,"Bouhght the game, registered. Flatlines everytime i try to run it, CD PROJEKT is the worst",Negative
Cyberpunk 2077,1091500,i need one happy ending,Negative
Cyberpunk 2077,1091500,"Stay away from that game, it constantly crash.",Negative
Cyberpunk 2077,1091500,"another game where you go to a base and kill people 50,000 times in side missions before you get sick of it and never finish the main story line. doesn't offer anything new, feels like reskin of fallout with terrible driving mechanics. story is interesting enough, but generic at the end of the day. keanu wasn't anything special, if anything he sounded like he didn't want to be in the recording booth half the time",Negative
Cyberpunk 2077,1091500,your choices don't matter. you will die in the end regardless of what you do and how you play it out. there is no good ending.,Negative
Cyberpunk 2077,1091500,I enjoyed the game until 1 damn dialog choice ruined the whole experience for me.,Negative
Cyberpunk 2077,1091500,not fun,Negative
Cyberpunk 2077,1091500,new up dates trash. i used to ryun this city..,Negative
Cyberpunk 2077,1091500,i'd rather watch the woke little mermaid movie than ever play this bugfest again.,Negative
Cyberpunk 2077,1091500,I didn't play or 4 hours It wont play,Negative
Cyberpunk 2077,1091500,christ i love this game but there is SO MANY BUGS AND CRASHES,Negative
Cyberpunk 2077,1091500,Would be a thumbs up except for the three random crashes a day for no reason. I save often but still having to go back 10 minutes is dumb.,Negative
Cyberpunk 2077,1091500,add takemura romance,Negative
Cyberpunk 2077,1091500,A profoundly boring open-world RPG with a story and characters I don't care about and one of the weakest cyberpunk aesthetics I've seen. Also the obsession this game has with Japan is embarrassing.,Negative
Cyberpunk 2077,1091500,"It is 2023, the game has been released for 3 years, and the pc keybind system doesn't work.  Also, driving feels like you are on a boat with the rudder dragging on the bottom of the lake.",Negative
Cyberpunk 2077,1091500,Product refundedyikes,Negative
Cyberpunk 2077,1091500,"Still broken as heck.I played this on day one, and it was every bit the mess everyone thought it was. After 2.0 they claimed it was better, but I still get model bugs in the main story, T-posing peds everywhere in the ""welcome to night city"" cinematic, and a lot of various issues. If you're waiting for the game to be fixed, keep waiting.",Negative
Cyberpunk 2077,1091500,2 Patches and an upgrade for my own setup and the game still crashes when I try to play it.I never had the chance to play the expansion and the base game is locked behund a new pc because apparently my current one is to weak fo this game.Game is nothing amazing it's ok at best but that is only the case if one you know could play it.Get it when a sale hits because full price is too much for this.,Negative
Cyberpunk 2077,1091500,"Awesome story, awesome world, ruined by awful optimization.",Negative
Cyberpunk 2077,1091500,"I figured they'd have fixed the game by now, but now I'm unable to even launch the game...",Negative
Cyberpunk 2077,1091500,just buy anything else,Negative
Cyberpunk 2077,1091500,they really really changed the game and not in a good way.,Negative
Cyberpunk 2077,1091500,boring,Negative
Cyberpunk 2077,1091500,Still crashes consistently. The story is so slow. SO much dialog. Ive watched story more than I have played the game.,Negative
Cyberpunk 2077,1091500,cant even launch the game,Negative
Cyberpunk 2077,1091500,"Game got ruined with lazy level scaling, was fun loved coming back for it again and again.... then the devs went the bethesda way and ruined it with level scale garbo if they allowed people to turn the trash off maybe it could be salvaged, as is now, nope.",Negative
Cyberpunk 2077,1091500,Gibt's immer noch nicht 3rd. Person.Man bekommt Epilepsie nach einer Stunde auf Steam Deck.,Negative
Cyberpunk 2077,1091500,The mission chippin in still not working. you put iconic items that all people wants into a broken mission ...thank you.,Negative
Cyberpunk 2077,1091500,Wasted potential,Negative
Cyberpunk 2077,1091500,"i want to me fully naked in game, when im in a fight i want to be able to see my 2 in monster swinging getting in the fresh breeze but this game hates me",Negative
Cyberpunk 2077,1091500,game suck,Negative
Cyberpunk 2077,1091500,"Product refundedCharged me twice, refunded me once and took my license. They haven't responded to any of my messages about it.",Negative
Cyberpunk 2077,1091500,Waited 3 years to play this...And it just crashes after character creation every time...,Negative
Cyberpunk 2077,1091500,Not worth for price.Ain't no way this is AAA game...,Negative
Cyberpunk 2077,1091500,Amazing how after so long it's still so bad. Not worth the time or money.,Negative
Cyberpunk 2077,1091500,"Not optimized after all these years, buggy mess. i913 and 4070ti, 4k minimum graphics is a no go. bugs upon bugs, pass on this.",Negative
Cyberpunk 2077,1091500,"Was literally only 20 minutes into the game play when during a cut-scene the characters were walking towards each other doing a default T-pose, then they glitched away and the textures started warbling and going slightly wonky. Trash, if it happened so early, I can only imagine, listen to the bad reviews",Negative
Cyberpunk 2077,1091500,"Shoe-horned story line with a path already laid out for you, cant be your own character. Also this game is about half cut scenes.. I just want to play a game, not watch it. AI is dumb, found cars burning in middle of roads with NPCs in them not doing anything, same with the cops right behind them.World feels like multiple dev teams worked on individual projects then smashed them all together. Hell one of the opening missions has your character lean out of a bullet-proof car window that magically isn't there and re-appears after the scene...Not sure how it got ""Very Positive"" reviews off half ass game.",Negative
Cyberpunk 2077,1091500,A big mess full of bugs,Negative
Cyberpunk 2077,1091500,no sex scene with silverhand,Negative
Cyberpunk 2077,1091500,More like Yikes Punk,Negative
Cyberpunk 2077,1091500,Flatlined,Negative
Cyberpunk 2077,1091500,"This game is good when there are no bugs or animation problems. Unfortunately i suffered bugs pretty much throughout the whole game like not being able to save or quick save, all color disappearing making the game black and white making it impossible to see anything inside buildings, my hands stretched to the floor for around 10 hours of playtime, and a lot of ncps had animations that clipped in to other objects, pouring alcohol on the counter instead of the cup all this could happen with any npc whether it was a cut scene or not. Dogtown has a bug where you for some reason can not take the elevator to the guy that gives you the gigs making it impossible to complete all the gigs.",Negative
Cyberpunk 2077,1091500,"Maybe sell a game that can actually start. All of my ""play time,"" has been used to try to start the actual game and I can't make it past the startup before crashing and getting a ""woah Cyberpunk 2077 has flatlined."" I've sent over 30 reports about my issue and have uninstalled and reinstalled three times already.",Negative
Cyberpunk 2077,1091500,Good graphics and action. Unplayable due to bugs. It is not fixed. It does not count as a game. Some missions you cant even start. Disgusting for 60 dollars. FIx your damn game.,Negative
Cyberpunk 2077,1091500,Version 2.0 ruined the game,Negative
Cyberpunk 2077,1091500,Boring just like all those Keanu Reeves movies.,Negative
Cyberpunk 2077,1091500,Still a buggy mess,Negative
