text,label
"Do you want to explore an untamed universe? Do you want to experience cultures that have developed separately into their own distinct people with the influence of the environments they've settled? Do you want to go raiding and pillaging with your space pirate crew? Do you want to explore interesting planets? Do you want to prepare for dangerous hazards of a hostile alien planet? Do you want a challenge? Or do you just want to experience an interesting story?Well this isn't the game for you.You'll be jumping around with loading screens through disconnected bubbles where there's not much to be found, running into the same NPCs over and over again. You get to experience bland 21st century Americanized monoculture all across the galaxy with very little if any distinction even between factions which supposedly hate each other. Almost every NPC in the game is lawful-good and will hate you for any even morally grey decision making. The planets and dungeons on them are cookie cutter, which was expected, but not tastefully done. The procedural generation is bare bones and the AI of alien creatures is laughably basic. Don't expect to find any massive kaiji-esque creatures, either. I don't think I encountered anything any bigger than an Elephant or Giraffe. Doesn't matter how cold, hot, radioactive, toxic, etc a planet is. So long as you don't face two hazards at once, any suit will keep you safe. The game is dead easy, especially with some of the random look. I found an incendiary sniper rifle that does double damage to targets with full HP and already has ridiculously high base damage as random loot. The story is uninteresting, as well. I've never actually gotten bored with a Bethesda main quest and gave up on it before. You have very little player choice, the NPCs you are meant to interact with are generic cookie cutter monoculture lawful-goods, and it's yet another chosen one story.You'll have a more complete experience by playing Star Explorers. This is perhaps Bethesda's worst RPG to date.",Negative
"Its like portal, but 2",Positive
The real counter-strike 2 is the friends we made along the way.,Positive
Not even a copy paste game it's literally worse. No reason to buy unless you really want updated roster and only buy when on sale. When will 2k ever learn?,Negative
"Crashes for no reason at the most random points, completely unplayable for a long period of time.",Negative
Un-modded experience is polished and clean. Feels intuitive and complex at the same time. Allows for multiple story paths even within each start path. Can't wait to try the game modded and would recommend for 'must have' shelf for any gamer.,Positive
very great farming game. good details and epic soundtrack.,Positive
is so bad,Negative
"Great game, but the game goes out of it's way to make things difficult.  I quit because the perfect guard window is way too narrow and the Door Guardian is just not fair.  ""Hard but fair"" is an idea they didn't steal from FromSoft.",Negative
nc 1,Positive
Product refundedThis game was a buggy joke... barely started and ran on my 4070ti... couldnt save my games... zero developer updates. Real shame to be honest. But Civ 5 is much better.,Negative
I really wanted to like it...Its just so aggressively mediocre. The concept is interesting but the characters are so boring and the gameplay is not good enough to make up for it.,Negative
scrpiting asu,Negative
I played this game for 40 hoursEverything DeletedSad timesWhy?,Negative
Stop !!! If you're going to go into this game thinking it's going to be like every Bethesda game just don't open your mind to New horizons... I've played this game for 181.7 hours and my honest opinions yes it has bugs yes the loading screens do suck yes you do get to a point where things just blend in after 100 or so hours... But the games enjoyable and fun sometimes I get sucked into it exploring every little corner seeing if there's anything hidden doing wacky stuff.. and the story and the four main side missions are really well put together.. I say play you'll enjoy just don't go in thinking it's going to be like elder scrolls or fallout this is a new IP trying new things that Bethesda never done before and I can see the love and passion that they had when they were making the game... This game is a building block of hopefully what will come if there's a sequel...and lol please put out the creation kit ...,Positive
good gam fumbs up,Positive
cant log in on rockstar launcher,Negative
"Decent survival game, but it's one of those bro games. You can only really fully enjoy it with people, not alone.",Negative
Early Access Reviewseek god,Negative
best game i have ever played love the xmas vibes brilliant couldnt recommend it more,Positive
"It's a game that never gets old. Fight, research, politics, whatever you want. Just a lot of fun.",Positive
Gud,Positive
No server browser.Can't turn off anti aliasing.Nuff said,Negative
It might take me another lifetime to cure my heartbreak from playing rdr2,Positive
very bad game bad community,Negative
"game is awful, crashes all the time, massive input lag, serious lag after corners and goals",Negative
no sex have to get a mod,Negative
Game is still riddled with bugs,Negative
"This game IS NOT CRAP!!for years now i have avoided this game because of reviews i have read saying it was a buggy mess. Well its Bethesda so you know there will be bugs, but i have only come by a few. I was worried about the stash box problems i read about but it was OK if you don't horde everything like me. I know the fallout 1st membership gets a hard time from everyone but i got a month to try it out and am willing to pay for it while i am still playing this game regularly, having a private world to mess around on is nice to just chill and farm junk after work. As for the story there is a ton of lore and quests, i didn't even talk to anyone for like my first 10 days i was so busy just running around checking stuff out.",Positive
3 years too late,Negative
"Regular crashes ruin the experience. Tedious grinding for resources makes the game a chore and combat is cumbersome and often unsatisfying. The amount of in game purchases are downright predatory. Honestly, don't get this game unless it's super cheap, and even then you'll probably get more out of different games.",Negative
doent work for me,Negative
"One of the best games I ever played.The basegame is fantastic, and Phantom Liberty only adds on more excellent content. The bugs are -mostly- gone, and the rare ones that show up more or less make me go ""haha, that's stupid"" instead of being frustrating.I am very picky about the games I play, and a rare few treasures capture me like Cyberpunk did. I can't recommend it enough.",Positive
Its GTA V man what else I need to say,Positive
"I've played Civs 4-6 and Civ5 is the best one of them, so my negative review applies even more to other games in the series.Civ5 lacks meaningful interaction. Almost all decisions are internal.Most decisions are obvious, yet you still have to make them. Yes, this one caravan still will go the same route that makes me most money.Most decisions DON'T MATTER. Game lacks heavy, meaningful choices past early game.Late game is really boring.Nations are asymmetrical, but differences between them don't translate in differences in gameplay. Almost every nation plays the same.Combat is almost always meaningless. Most of the time you are not required to have any military units available to you and building them wastes a lot of time. Which means, the best move is always to befriend your neighbors and focus on internal affairs and economy. That reduces any player interaction to almost zero, because politics is shallow, superficial and pointless.",Negative
Just finished the game and already looking forward to the second playthrough.One o the best RPGs ever.,Positive
a really bad port of a very mid game,Negative
"No fun just frustration. Mission, visual and audio glitches. constant logging in and out to get it to play right for a while.",Negative
changed my life fr,Positive
"for my first game, best game ever",Positive
amazing game but im just too stupid,Negative
Gambling but you don't lose money. Perfect for my addiction.,Positive
Nice!,Positive
"Steam doesn't work on the game. Can't play with friends Overlay not working. Steam no help with finding the issue, Game maker is also no help.",Negative
Goodest game,Positive
Perfect,Positive
"don't listen to people that still complain about this game back in it's release, the game is great now!",Positive
funny radiation machine go brrrt,Positive
portal good,Positive
"i have a 3050ti and a i9, and even on LOW and performance mode, i am lagging realy hard and the legspikes are gamekilling.",Negative
Product received for free.,Positive
Product received for freeTHE BEST GAME,Positive
Not as good as FO or TES. They try to have the grind of a game like Diablos where you restart getting stronger all the time but the stories are not really engaging.,Negative
I love the silly skeletons,Positive
Bethesda has made some of my favorite games - but Fallout 76 makes it clear they hate my guts.,Negative
good,Positive
Only positives youll see is with the CSGO reviews,Negative
The story was written by a 5 year old.,Negative
great game,Positive
False promises.,Negative
Writing the review in the hopes that BGS makes a chatGPT response. By the way No man's sky is more next gen than Starfield AND it came out on the PS4 and is even on the switch. Why are there so many loading screens and fake loading screens as well? I can skip a loading screen by taking the stairs but taking a elevator somehow forces me into a loading screen. It's almost like Bethesda doesn't know how to animate an elevator.,Negative
this game is fun,Negative
game,Negative
Waited 3 years to play this...And it just crashes after character creation every time...,Negative
portal 2,Positive
Amazing. Enjoyed it better than the 6th. More realistic graphics and more in depth gameplay,Positive
Good game,Positive
"Very bad, tedious and everything feels like a chore. Progression is awful",Negative
"i dont think this i a very good game , now keep in mind i just played it for less than an hour and i find it very boring and repetitive . this is just me i think some people will find it fun though",Negative
Has nudity and violence. NOT FAMILY FRIENDLY,Negative
gun play is moot,Positive
This game falls flat at everything it has to offer,Negative
its so fun and just really a beautiful game.,Positive
do not buy this game crashes all the time.  I cant even play 2 mins without one problem DON'T WASTE YOUR MONEY.  This game is so bad I'm ready to uninstall the game,Negative
gg,Positive
"Waste of money, this game is not supported , will not launch, WTF ! FM 23 works fine . the game has been destroyed.",Negative
"a little different from most battlefield games but still fun, all the bad reviews are just people being butt hurt lol so ignore them",Positive
"The game is good, just play it through and it's a really good experience the reviews are a bit too negative imo",Positive
It's so good.,Positive
mega,Positive
This game is filled with bugs and almost unplayable competitively. The matchmaking is unfair and pairs 1200 with 8000. ridiculous,Negative
Early Access Reviewvery VR not much CHAT,Positive
"A step in the right direction compared to Diablo 3, but such a small baby step followed my a horde of big ogre steps of let downs and disrespect",Negative
the fact you need the rockstar launcher after buying on steam is a joke.,Negative
super fun to play esp w friends or alone,Positive
Great game with different avenues for victory,Positive
Football manager always the best,Positive
bad,Negative
was not possible to give myself head through the portals,Negative
"I know I am in the minority here but this game never really lived up to the hype it received.The whole concept is to subvert your expectations and in that it does succeed.I play games for their stories and the one presented here is nothing special if I'm being honest.I think it deserves praise for the clever design but as a game, it's not very good. It's more of an experience.",Negative
Product received for freeJust a CHEAP copy of Spider-MAN!,Negative
Would be a thumbs up except for the three random crashes a day for no reason. I save often but still having to go back 10 minutes is dumb.,Negative
Everything,Positive
Masterpiece.,Positive
Best Story telling,Positive
amazing game,Positive
sam kerr bonkers,Positive
klaus the shark,Negative
"I really want to like this game, but but I really don't... The combat mechanics feel heavy and clunky, the perfect guard is tedious, the dodge is short and slow, and the animations of those actions can't be interrupted. It all makes for a slow and fustrating gameplay that feels poor, inadequate and dated. All other aspects of the game are great, from the OST to the level design. Too bad.",Negative
"Somehow a hybrid of God of War, Assassins' Creed Valhalla, Far Cry, and every other game of that ilk.Yet, it completely stands on it's own, is unique, and well worth playing.",Positive
"In this game you too can experience the wonder of southern american schools, filled with all the things you'd expect in such a place, mangy dogs, shanking, vomit that can chew through floors, deranged pastors that will fling ceiling tiles at you, interdimensional horrors that can kill a man if they look at them for more then 4 seconds by shear fright alone, and of course, guns.",Positive
I love all Larian's masterpieces. Thanks Larian.,Positive
"Purchased on that FIRE SALE!Very much worth.Ive gotten some of my friends to get it tooo!GET THE GAME and DLC on sale you wont regret it, If you like these type of games",Positive
game used to be good,Negative
Solid game . i played it for years.,Positive
once played 43 hours straight and almost died,Positive
I'd love to recommend this game - but it crashes constantly.,Negative
all it does is CRASH!!!!!!!!!!!!!!!!!!!!!!!!!,Negative
"Fun, difficult, addictive. I love survival games and this was right up my alley",Positive
my enjoyment of this game ended along time ago this game is more like a job now.,Negative
gud but the players are very skilled,Positive
"The core gameplay is fun. Too bad the game insists on pulling you away from it. Endless dialogue, endless interjections, random cutscenes causing the time to skip, and tedious fetch quests galore. This game has a ton of promise, but by Chapter 3, the tedious distractions are too much to be called fun. My breaking point was the pointless 30 min unskippable cutscene about the chef's backstory. Let me fish and run my damn restaurant in peace.",Negative
Amazingly Good!,Positive
"I think this might be the worst game I have ever played, the passing is beyond terrible, not to mention my players don't defend at all and don't do what I tell them, like when I do make a good pass the player is always running away or in the wrong place like Jesus and my game mode isn't even on the harder modes, its on professional! anything less and its too easy, anything more its unrealistic, why cant this game be fixed its beyond stupid. worst game",Negative
space,Positive
"after I played stardew valley,I can't believe dave was made by a team.you team let me know how boring to be a millionaire",Negative
dope,Positive
Product received for freelittle toddler kills me for killing everyone.,Negative
Why is this still a thing?,Negative
i played this game when it came out and it was pretty bad. here i am 6 years later to tell you it's still just as bad if not worse lol. still very clunky and lots of server lag. please go play apex or something,Negative
"Awful performance and annoying sound bugs in 2.0, unplayable at this point",Negative
"""Confidence is a slow and insidious killer."" - Alpha and Omega of this game.",Positive
"super fun game, in remastered i was peter, now i am mileshow cool is that",Positive
"not sure what all the praise is about. lost interest about 5 hours in. I'm a fan of management games, sims, rpgs and roguelikes, yet the combination of these gameplay elements in the title were just plain boring. pretty disappointed. especially since i passed the refund window hoping it would hook me.",Negative
UNDERTAL,Positive
"Yeah, it defiantly looks nice, but something about it just feels wrong. Wish I still had the option to go back to GO.",Positive
trash,Negative
boop,Positive
Beautiful,Positive
Product received for freemang this game some assssssssssssssssssssss,Negative
"It's an amazing game. Great combat, story, voice acting, and awesome tools and weapons.",Positive
"for the first like 20 minutes i was like ok this is a cool dark souls like gamebut it really kind of feels to me more like they tried to copy dark souls and didnt do super well at iti dont feel like the bosses are as telegraphed as souls bosses so when you think you can dodge, you cantidk",Negative
"Incredibly buggy release. There are constant issues with UI being slow and twitchy, shortlists clearing themselves on save and so fort. Otherwise seems to be an evolved game before the big engine change.",Negative
Movie game,Negative
The game crashes FAR too often.,Negative
Cannot sex the chicken,Negative
essa merda nao salva na nuvem merda de jogo vo pedir rembolso dessa bosta,Negative
this game sucks. I LITERALLY CANNOT PLAY IT SINCE IT JUST GETS STUCK ON THE FIRST CUT SCENE,Negative
Worked and was alright for a few days but now it just crashes after every single round. Also the game intentionally makes your grind worse by limiting XP against bots,Negative
you cant date clint,Negative
the story had me hooked fr,Positive
"redownloaded the game, only to find out all my progress has been deleted.",Negative
"Play this game if you enjoy multiple timelines, dont mind constantly restarting from checkpoints and REALLY dark twists and secret endings",Positive
"hackers and terrible gameplay, keep your money",Negative
I don't get what's the appeal.,Negative
Very fun!,Positive
I enjoyed the game!,Positive
"I loved CS1. I heavily modded CS1.Cities Skylines II is exactly what I hoped. A great foundation for future DLC and mods.There have been issues yes, but updates have come fast. I am very optimistic. I can't go back to CS1 after playing this.",Positive
good game buts needs a bit more work,Positive
i keep dying to creepy flower,Negative
"You kinda get tired of getting logged out of the session back to history mode every time you enter online, and if it does not happen in the middle of pretty much anything, a loading screen glitch or a modder while take responsibility for making your experience worse. Any game will have modders for sure, but the amount in this game is concerning at this point...",Negative
They lied.Japanese leagues aren't available.. This is low even by SI and SEGA standards.,Negative
its marvellous game with great graphics downside the refs are always penalty happy never a yellow or red card for serious foul play or diving,Positive
Product received for freeI have no friends to play coop with,Negative
"Geurilla can keep making these beautiful, super fidelity games all they want, but they're never gonna actually be fun",Negative
Terrible overall. Enemies are mindless bullet sponges and its all about grinding gear. The gameplay is not fun. It is a game for people who don't have a life.,Negative
I want Spider-Man 2 on PC,Positive
fun game,Positive
"this game is hard at the start, but once u get the hang of it, its very fun and u start the get used to the controls",Positive
Good,Positive
thank god they have mods in this game,Positive
"I definitely do not recommend it. There is no problem when playing with my 16 GB graphics card, but unfortunately the game either does not open or constantly crashes. It keeps the menus waiting for about 2 days. I worked for 1 week and read a lot of resources about this problem, but it still did not fix it. I think people have been working on this issue for 3-4 years, but they cannot get any results. Is the game good? It's hard to understand because it's not playable. Not to mention the problems and ruptures between Ubisoft and Steam. Unfortunately, it is obvious that no effort has been made on this issue and the problem has continued for years. I say this as someone who has bought almost all AC games. I messed around with my computer so much that it started to cause psychological damage to me. I deleted the game and now I'm trying to get used to my computer again by spending time playing other games. If I had known that returns would be accepted, I would have, but it was too late. I am someone who has never refunded a game in my life and I would do this.",Negative
Its a classic,Positive
game is very j,Positive
"Poor controller support. No matter the settings or controller, it keeps randomly disconnecting and will not reconnect. Issue has been on-going for a long time now and has not been resolved.Tried wired and wireless.Modded and non-modded games.Three different controllers.I have not experienced this issue with any other game.A quick search shows others with the issue. Some manage to get it resolved or a work-around, but none have worked for me. This isn't really an issue that one should have to work-around either.",Negative
"One of the best games in modern history! Playing through a 2nd time and with the DLC makes this game almost perfect with all the updates done to it. Also, the modding community make this game something really special!",Positive
The counterstrike community no longer wants to support learning. even for players who have basic understandings of tactics,Negative
Product received for freeVery good but hella short,Positive
"Gets boring after awhile. The quest don't draw you in, there are a ton of glitches still, and they don't even try to fix the known issues. Furthermore, they only care about the atom shop and making money. If you don't have first membership then you miss out on a lot of helpful stuff. This is just a cash grab for them.",Negative
Anti-cheat is non-existent,Negative
"Just watch cutscenes compilation on youtube, and keep playing Path of Exile for free. I found nothing interesting in D4, and I heard endgame is even more boring",Negative
Absolutely soulless,Negative
Not a great game for people who have played AC games in the past.1. Map is insanely large with repetitive side quests2. Characters are not likable3.  Vikings don't fit assassin play style4. Multiple game crash even on lowest graphics. And I am running the game on 1080Ti,Negative
"Game has come a long way since launch, hopefully they take what they learn and apply it to the future of Battlefield.",Positive
Lies of Parry,Positive
Early Access Reviewdont really play it all that much but its ok,Positive
eh,Negative
"Dawg, play this game",Positive
Dopamine!Played over 15 hours on Xbox and it actually might be the most addictive game I've ever experienced.,Positive
I nutted allover GLaDOS by accident...,Negative
In-depth and better than any other sports simulator.,Positive
road sim,Positive
glados is a baddie,Positive
good game to play with friends. not alone though. gets boring running around by myself,Positive
I have a joke that I want to dish out...after I finish washing my dirty dishes.,Positive
"Does Portal 2 improve upon its predecessor? The answer is yes, but at the same time, improvements seem marginal to me, save for the multiplayer aspect, which was possibly the most meaningful addition, and the most fun I had in the game.Portal's 2 story, save for some moments during Cave Johnson's appearance and the upbringings of Aperture Science reveal, is as mundane than its predecessor's, with the writing resembling a Disney movie really. The ending is ridiculous, but in a bad way.Puzzles are the same level of difficulty as Portal 1, afraid to challenge the player in any way. Even though an easy puzzle can still be a good puzzle given the context, what was missing here was exactly that context, so I felt I was flying from one easy puzzle to the next, without exploring the possible puzzle space given the mechanics, or pondering more thoroughly about an interesting interaction.Traversal is improved, I actually liked the walking simulator-like parts and enjoyed exploring Aperture Science in its entirety.Overall, Portal 2 does not hold up today as people claim it does. There are much better games today, story-wise, gameplay-wise, design-wise, in regards to puzzles, mechanics-wise, and what they can make you feel and experience.",Negative
I Like the interaction with various items,Positive
"Product received for freeburanya, this game is ok",Positive
Viking,Positive
"The online mode really wants you to spend money.Also the movement mechanics kinda suck.Messing around in the open world is pretty fun, but I find just cause 2s open world to be just a bit betterAs for the campaign.I really liked it however it really feels like some of the missions are just trying to waste your time. It has an amazing pay off but it feels really stretched out. then again maybe i should've just been fast traveling with the taxi.",Negative
good gam,Positive
"A happy place of mine, love 76, been here since 2018 and while yeah it can get stale, that's just something that happens with every game when you play it so frequently",Positive
still no sex with big robot lady,Positive
too fun,Positive
"This is just a fantastic game, with great game play and storytelling. I highly recommended playing this game.",Positive
Too many chinese... Actually i don't hate chinese player but the fricking loud mic and spam is really annoying,Negative
great game fun and very dynamic,Positive
