text,label
"it was once a good game, but, wayy too milked, online is practically unplayable, if you're new, either given money from a modded, or just stuck on a constant grind.Modding killed the game imo but its been dead forever, just work on a new game..",Negative
"It's too short to be a full game release in my honest opinion. This should have been a DLC to Spider-man 1. It's a very cool game otherwize, but not worth the money.",Negative
too many tanks and helicopters. U have to nerf this we cant move,Negative
"Leave nothing unchecked, there is much to be found in forgotten places.",Positive
a relaxing game but be ware the mines they can get dangerous,Positive
FUN GAME,Positive
"It looked like a fun game at first, but I decided to refund it.Collecting scraps is way too difficult, and having to manage the shark is just annoying.You might enjoy it, but it isn't for me.",Negative
Early Access Reviewno,Negative
"Apsolute classic. I like realistic graphics more than cartonish one from Civ 6. So, even 13 years later, still my favorite.",Positive
so much blaad,Positive
my freaking save data is deleted ......,Positive
this game does not run well,Negative
very good har har harharhar black people very bad,Positive
"Rockstar doesn't care if the gameplay is fair or not . they can't even ban the modders in this game , not worth it if you wanna play , play it in invite only lobby with your friends and keep away from public lobbies",Negative
Crazy how they managed to make it worse than last year,Negative
"Incredible game but online is basically unplayable. Hackers everywhere, dead lobbies, loading screens, disconnects.",Negative
bugs,Negative
Masterpiece,Positive
Fix the Serbian league registration rules ffs,Negative
"this game gave me cancer, pretty good.",Negative
"No next genNo story in mycareerAtleast 100hour to get better build or pay 100bucks least, buy ps5 version or buy 2k23",Negative
"CS2 is just CSGO, there's literally no difference.",Positive
"Yes, I love this game.  I like the diverse landscapes, and the slow steady exploring of planets.  Also, the varied mix of missions types is great. Parts of it remind me of 'fallout' , which is a fun vibe.",Positive
is so bad,Negative
Very disappointed. Regret preordering this.,Negative
Early Access ReviewDISTASTEFUL. that is how i describe the new update. for starters. WHO IN THE RIGHT MIND THOUGHT IT WAS A GOOD IDEA TO ADD TRANSACTIONS. a free game that makes you pay money to support people when its more likely to pocket most of it and give only a fraction of the little amount given back. two. THE GOSH DANG CONTENT FILTER. i get it you know. VR chat has way to many kids in the game and they should be protected from the harsh environment. but if you wanted to do that DONT MAKE IT SO THAT PEOPLE WHO ARE BELLOW 18 SUFFER. the minimum i think would be 14 maybe 15 NOT 18 SO THE REST OF US NORMAL PEOPLE HAVE TO SUFFER! so many of the avatars we either took ages to find or even upload. striped away from us because is has a content warning! great idea guys. round of a applause! so in short. VR chat has become nothing more than an underage kids playground where they can throw away there parents cash at to pay for stuff THEY NEVER NEEDED. EVEN REC ROOM WOULDN'T STUPE TO THIS LEVEL OF SCUM! even better?! they LISTEN to there COMMUNITY! unlike SOME PEOPLE! i have grown up with this game. and it pains me to say it. but after today. after seeing the derection there taking this game. i might as well cancel my subscription and find a different game to play. cus after this? there is no recovering from this! they have hit rock bottom! the only way to fix this garbage is to just restart it. take the game back a few years! why not?! it worked for fortnite! and everyone looooooved that?!. so in total. . wait for them to fix these problems OR DITCH THIS GAME,Negative
"""Raft"" is a PC survival game that sails above the rest with its captivating blend of challenge and charm. Set adrift on a makeshift raft in an endless ocean, the game delivers a visually stunning experience that draws players into a world teeming with marine life and danger.The gameplay mechanics are the heart of ""Raft,"" offering a perfect mix of scavenging, crafting, and survival. Starting with just a hook, players gradually build their floating sanctuary, constantly juggling the need for resources and the ever-present threats of hunger and dehydration. The intuitive crafting system keeps things dynamic, making each decision feel crucial to your virtual survival.One standout feature is the cooperative multiplayer mode, allowing friends to join the adventure. Together, you can build, explore, and face the challenges of the ocean, creating a sense of camaraderie that enhances the overall experience.While ""Raft"" excels in many aspects, the early game can be a bit slow, requiring patience as you gather resources. Some may also find the limited variety in environments and the repetitive nature of resource gathering a bit monotonous over time.In conclusion, ""Raft"" stands out as a captivating survival experience with its stunning visuals, engaging mechanics, and cooperative multiplayer option. If you're a fan of survival games, ""Raft"" is a must-play that offers the thrill of exploration and the satisfaction of building your own floating haven in a beautifully unforgiving ocean.",Positive
5 was way better,Negative
Didn't live up to the hype but still a good game. Done nearly 100 hours now casually. Stick to the main faction and story quests.,Positive
Incredible game,Positive
"The lag and cut-scene delays are atrocious in the end of Act II and all of Act III. Game is completely unplayable. Whoever voted for this as Game of the Year clearly never made it this far into the game. Too bad, it was a great game until those points.",Negative
"Tried it out with a friend, biggest mistake of my miserable life, audio issues from the get go, crashed twice trying to launch it, not worth my time or money even if it's on sale. Dumpster fire of a game, equally trash company....",Negative
glados made me depressed,Negative
"Product received for freeto play this on normal difficulty, you have to eat and drink water tremendously fast, it made my girlfriend refund this game, maybe make the water stay replenished longer as well as the food stay replenished longer, would have made a better experience, yes I know there is a peaceful mode and an easy mode, normal should not be designed to eat and drink water every 5 minutes, I like normal because of the pve aspect and difficulty. 5 out of 10 is my rating. It definitely was not a skill issue, on the hard difficulty I would keep the game the way it is.",Negative
This game lost it's total uniqueness and It's boring to me now. BORING!,Negative
"Dave the Diver is joy to play, at least, it is until you make it to the end game. The storyline is cute and well-thought out and the mechanics are pretty front loaded, allowing you to get a good feel for the game quickly and start working your way through the game-play loop. There isn't much challenge to the game, and that's alright, the overall vibe, play and art style all lend itself to a comfy game time with little to stress a player.  This would definitely be a recommendation I'd put out for getting a pre-teen or early teenager into gaming.The controls of the game are tight, its easy to understand and the games advancement and upgrading is all very linear. Only the guns offer any sort of ""hunt down x"" that can get annoying, but even then, its not hard to figure out.I really have few complaints about the game, but they all have to deal with the ""post-game"" so to speak, so they don't really detract from the base game, which is a polished gem.Complaint 1.The ""Cooking Mama"" Mini-Games that pop up towards the end of the game really come out of left field, and feel unpolished in comparison to the rest of the game. They aren't bad, but I also don't feel anything would have been lost by just excluding them.Complaint 2.Dives start to take excessively long and become very repetitive post game and even leading into the post game. A ""good dive"" can typically end up being close to an hour or longer a pop. Which when there is incentive to go after the same fish every dive, it can feel very samey, very quickly and all the polish loses its luster.Complaint 3.After the story is completed, there's not a whole lot to do anymore aside from maybe 1 or 2 bosses, depending on how quickly you progressed, and just running bancho sushi. But when the vast majority of the game is spent on dives, it becomes disappointing that there aren't anymore surprises, its just achievement hunting. This can be especially troubling when its possible to demolish the game without much in the way of gun upgrades, and a staff that's only a quarter or slightly more leveled.  After that, it just makes things even easier.All in all though, I still adore the game and plan to get all the achievements before retiring it.",Positive
literally the most immersive game i have ever played.,Positive
"Really not as buggy or poorly-performing as some say, would recommend.",Positive
It is fun just to jump in and scout the areas. Very relaxing. I am new to the game but it seems fun. So far. only level 10.,Positive
All the updates since launch are great additions. Am re-hooked on this game,Positive
"The game has its good sides like great graphics, story, soundtrack, voice acting, but the combat and NPC AI is insultingly bad.",Negative
"Man made co2 has no measurable impact on the temperature in the real world, yet in this game it is the defining feature. This lack of realism is a major letdown. To have your game suffer so much to push a false narrative is truly embarrassing. Please give me my money back.",Negative
Fun and good,Positive
Unable to connect to EA Servers,Negative
gg,Positive
Just no,Negative
csgo was goat,Negative
"I have witness this buggy game becoming more and more buggy. I thought I will get used to it eventually like a ""boiling frog"", but I was wrong. I eventually can not bear it anymore today, right on the Thanksgiving day. The disgusting bugs in this game finally devours all of my thanks to all the time with this game.So, I will not give any thanks nor likes to this goddaamn buggy game which incite players attacking each other. If GTA VI is also buggy like this, I will definitely spread pirated for revenge on the clumsy game developers.",Negative
Natural Disaster with rtx on,Positive
Once in a life time game,Positive
This game is amazing and CDPR supports the game with new updates,Positive
its awsome,Positive
would not recommend,Negative
very game.,Positive
dO I Really need to leave a review?Buy it and do some crimes!!!Oh can i call you criminal scum?,Positive
nice,Positive
"Man this game is really bad. I cannot even get through the first ""kill rats in the stable masters shed"" mission. Its reeks of the same game made over and over and over and over. Inventory system is horrific. Combat is dull. NPCs are just voids. Menus upon menus. And I honestly do not want the option to pick up every single coffee cup in the place. Space combat is TERRIBLE.",Negative
if you want a simulation play the 1st game this is a half baked attempt.has huge potential but falls very short.rather than address the issues they post there dlc schedule which just tells me they are not listening to feedback.,Negative
Agore to hard nerf plz,Negative
Excellent strategic game with development of technology following historical facts!! Very engaging and every game is different!!Recommend it!,Positive
"steam wont allow me to play diablo4 when i alrd bought it on battle net, noob blizzard",Negative
i cant even play with wasd keys,Negative
"This game offers co-op mode however it will continuously quit every few minutes, and the game developers are aware and yet it hasn't been fixed. I love the game but can't in good faith recommend it with a bug that makes it unplayable in co-op",Negative
I got this for 15 dollars. Great fun. Mechanics and basic structure are fun for awhile and the visuals are awesome. At 30 hours getting less fun - I've experienced most if not all of the mechanics and environments.,Positive
yes! yes! yes! mmm!,Positive
nah,Negative
"It's fun mixture of advanced technology and bones and rocks tools and also mecha-dinosaurs and animal are unexpectedly a good touch to the game, and it has a REALLY big map for open world game which is nice and also the grind is not as much as i expected, one tip tho, every time u found or encounter something that can be collected do it, especially ridge sticks, you are gonna need a lot of arrows and also try to use your focus every time you're travelling since if u detect animals, crouch and ready to kill them since you need to drops from animals to further upgrade your equipment especially your arrows quiver since you can only hold a limited amount of arrows",Positive
This game makes me want to eat my microphone and hit my head against a brick wall,Negative
yes,Positive
"Product received for freenice game, but quite laggy on low end potato pc",Positive
This game isn't remotely worth it for 70 dollars. The story is also vastly shorter than Diablo 3's. It's campaign is more or less just one act of 3's.,Negative
They did it. After few years of repairing and fixing game is in great shape. I enjoyed every minute of my second replay.,Positive
"No I'm not going to learn to do mandatory parrying, thank you. Dodging was good enough for Dark Souls and Bloodborne and I don't know why you've decided it isn't good enough for you.",Negative
"i love this game however the screen is always flickering black, red , green each time i open the game in full screen , i have this problem with the other game i own as well",Negative
What can I say. CS will always be CS.,Positive
fun game but crashes constantly. 3060ti,Negative
Revisit in a year.,Negative
6 hour shift at the dopamine factory,Positive
based,Positive
honestly for how old this game is now i'm irritated I got bricked at the white house lawn mission and couldnt proceed past that point and already have to restart because of a dumb bug that shouldnt be an issue. Hopefully I dont lose any of the stuff I claimed from my mailbox because of this.,Negative
this might actually be the worst game I have ever played before in my entire life,Negative
this game lags so bad even with a decent gaming desktop there is no crossplay barely any info for figuring stuff out this was a waste of time and money for me i strongly do not suggest buying this game,Negative
sold my kids and bought mbappe great investment.,Positive
"This is a wonderful civilization builder with lots of variety. It is absolutely a blast to play with friends. I really enjoy crafting my civilization, and there are many paths to victory with always more actions available than you can take. I like the way wars work, with warmonger penalties, so you can't just rampage around attacking everyone for no reason. Cannot recommend this game highly enough, especially with a group of friends.",Positive
it's a masterpiece,Positive
Early Access Revieweveryone is weird its like seeing those two kids you really hated showing up at your workplace its just really rank,Negative
its very fun,Positive
"jogo muito bom, com potencial de melhorar muito com o decorrer dos anos",Positive
"I was very wary of getting this title  because of the mixed reviews it had. All things considered, I'm glad I bought it.",Positive
Early Access Reviewtoo many weirdos in this game that its classified as a global threat online,Negative
"Takes forever to join jobs with friends and joins public job at random, online mode keeps crashing or takes forever to connect, and need to spend an hr to just start a mission with friend.",Negative
Play the gosh darn game!,Positive
"I. should. not. have. to. allocate. an. entire. hard. drive. worth. of. space. just. to. update. a. game. O.OI had plenty of space to update, yet it wouldn't. I even tried uninstalling a few small games that I hardly play. No joy! Instead, here I am, uninstalling and reinstalling the game to a different drive to play with friends later tonight. If it weren't for the friends, I wouldn't bother at all. That's how annoying it is.",Negative
Huge problems even getting it to load and play. Even with reinstall,Negative
fun,Positive
"Bit buggy, but definitely getting better.  I have been enjoying it more than CS1",Positive
Don't like it.  Seems arbitrary.  I don't feel like I have control.,Negative
"Not fun, but I'll keep it cause it was cheap",Negative
IT is so good.,Positive
worse than the first division,Negative
"Wanna get this outta the way real quick. The final boss is absolute BS and should be so difficult. i know the game is perpetually meant ot kick your ass which is fine and its half the fun of the game hands down i enjoy that. But the final act is hands down some darksouls 2 BS with the game basically forcing you to cheese every last mechanic in the game to beat itAside from that it so long to understand a number of the basic mechanics of the game like leveling up or upgrading armor etc etc but when i put it all together the progression of that and rebuilding the town feels great and rewarding. The different classes are fun to juggle and that constant fear of characters going insane or dying is so rare to find in games but when it hits just right it adds another level on top of what is already a gerat game i wished i played sooner.Has really pushed me to try other games in this vein, like nadir, banners of ruin, slay the spire etc",Positive
Product refundedwith my Sh!tty computer,Negative
It's good.,Positive
the huge difficulty spike at the end was kinda dumb,Negative
Yes,Positive
"I really wanted to recommend this game. It has such great game play, but the bugs are ruining it for me. I have lost 2 sets of power armor, only getting the chasis back into my inventory. One of them was lost while I was in my shelter, I was getting rid of junk, and making a new core, and it was gone when I turned around! It wasn't even 6 minutes! This breaking of progression makes me want to quit the game. Along with the predatory micro transactions for repairs.",Negative
grand theft auto,Positive
Good Game but needs more end game Content.,Positive
its so good give me mbappe toty,Positive
Product received for freeEarly Access ReviewI think it's great for people who struggle with real life communication skills and confidence.,Positive
A lot of improvement in comparisons to 2023,Positive
it wont even let me in the worst purchase of my life i need help it just says that it is running but its really annoying i need reallly help,Negative
dead game,Negative
Early Access ReviewCOOL GAME LIFE,Positive
Awfully flawed combat experience. Could have been a great game but multiple mechanics that have no thought out concept behind it. Wish I could return but took me too long to realise. Just play FromSoft. No matter how are these indie developers try they'll never be able to compete. I'm not a FromSoft fanboy.,Negative
ass so boring sleep ong this is like Undertale rodreges twitter the 4th irl friend school fortnite edit worst game ever go play smthing else,Negative
"One big pile of shi.tt , feels like degenerated version of Fallout 4",Negative
If you have no friends it is basically pointless.,Negative
"1,177.7 Hours Played, Had Fun with more than 5 Friends in this Game, And Lastly been playing since 2017, This game was literally my decade.I published some workshop saves, had a blast playing on Zombie Survival Servers and Prop Hunt, Hide and seek and Sandbox.Now im starting a new Era with this game, My Best Friends are finally experiencing the Beauty of This Mod,We had so much Fun, We created so many Memories, and There is Still so Much to Live.This is the Best Source of Fun and Content.",Positive
Goblok sih ini game,Negative
This game gave me 86 separate brain aneurysms,Negative
idk wut to say but gd game ae,Positive
it's absolutely great with graphics and all,Positive
"Still, a total classic.. a fun game to finish with friends and also challenging at times but definitely enjoyable and not repetitive.. puzzles are cleverly designed and overall a very very enjoyable game",Positive
Early Access ReviewIt's fun with friends or too make friends,Positive
its alright,Negative
"I liked the graphics, the cinematic cut scenes are always awesome in the Diablo series. BUT, the game is a boring. I had better fun with Diablo 3. Also, their servers suck! High pings and disconnections. Thankfully I have noticed it during the trial of the game.",Negative
Early Access Reviewdon't just don't bro once you start you never stop...,Negative
pretty good game.,Positive
playing this game more than one time feels like youre being cucked,Negative
"Worst optimized game I have ever played.I have i5-8400, GTX 1060 and 16GB of RAM and on the lowest possible graphics settings with 90k population, prioritised simulation speed and 1600x900 resulution 1 min in-game time runs close to 7-10 sec irl. When I'm trying to move a camera while the game is stopped it freezes the game everytime. Oh and it always starts on a wrong monitor and there's no option in-game to change it, you have to change to windowed mode, move the game and change back to full screen.",Negative
Must create ubisoft account. game randomly crashes and launching game is always a chore with allowing ubisoft to make changes to your computer,Negative
the video presentation is not the same as the game.,Negative
Vehicles in this game are viable at all.,Negative
"For context, among From's games I think Bloodborne and Sekiro are their best ones. Lies of P is up there with these two.It feels similar to Bloodborne but with a parry mechanic a bit like Sekiro.",Positive
"for others seems like a good game but for me the only thing that ruins the fun of this game is the damn stress system. for me i think its stupid to have, its why i dont like it. if it was to remove it from the game i would probably play it again. but for now i am not liking the gamem, even with mods the game is so sufferable even on the easyest difficulty, this is a good game for those who wana get realy angry at the game. not recommended to play it cause it only makes you angry at the dumb mecanichs",Negative
its ight,Positive
"A little bit boring on the story and gameplay side, but if you like spacey stuff, customizing ships and overall just chill gameplay, go for itdont expet Skyring level shennanigans or fun quests, there is a couple notable ones and thats it",Positive
"If you come looking for an RPG, you will be disappointing.Is an action adventure game.",Negative
A masterpiece.,Positive
Early Access ReviewYes.,Positive
hmmmquite,Positive
no vibrators,Negative
"Product received for freei wish its performance should have better than low end pcs like mine. also i could not able to change resolution when on windowed full screen in order to improve performance of the game and since i got only upto lvl 20 in free trial its not a good mark to appreciate the trial, it would be alot better if it was upto lvl 50.",Negative
why are you reading negative revievs?this game is good. Buy it!,Negative
"Has its flaws, but was a geat experience.",Positive
Product refundedno,Negative
"This game is good when there are no bugs or animation problems. Unfortunately i suffered bugs pretty much throughout the whole game like not being able to save or quick save, all color disappearing making the game black and white making it impossible to see anything inside buildings, my hands stretched to the floor for around 10 hours of playtime, and a lot of ncps had animations that clipped in to other objects, pouring alcohol on the counter instead of the cup all this could happen with any npc whether it was a cut scene or not. Dogtown has a bug where you for some reason can not take the elevator to the guy that gives you the gigs making it impossible to complete all the gigs.",Negative
BF3 nostalgia. nice game.,Positive
I need more sans...,Positive
"Aesthetically pleasing and neat game, but gameplay gets boring over time",Negative
Fallout in space,Positive
not acceptable  Bugs makes it no fun not a pleasure to play this is the SECOND attempt its skylines 2 so why on earth is not working out of the box is really bad,Negative
Common Freddy W,Positive
best game ever,Positive
The game is good at what it does but for a game as simplistic as this one it is severely overpriced.,Negative
"gorgeous game, stunning graphics and good storyline.",Positive
Game is riddled with cheaters. Flying horses shooting cannons. DO NOT recommend!,Negative
good fun,Positive
Early Access Reviewwerst game in histriy gmod is beter then this gay kids game weird people play just why is this made in the world why there is beter games in the world but people play this game in sted why,Negative
Viking Blood. URAH,Positive
"combat, customization, enemy variety and story are all simply amazing. You will lose hours having a fun time losing to enemies but also learning how to defeat them and eventually overcome the challenge and feel exhilarated. Spectacular game.",Positive
A chore to play...,Negative
classic,Positive
good,Positive
lot of cheaters and crashes,Negative
"The eventual payoff is not worth the effort to learn the game. This game is very fun for a while, but eventually you realize that the AI is completely incompetent. All difficulties use the same AI but harder ones give the AI more bonuses. In previous Civs that issue was easily fixable with mods, but they prevented people from creating major mods in this one.",Negative
Always something to do,Positive
great mechanics and the story line is rich and full the movement feels a little sluggish from time to time,Positive
BRING BACK THE WORKSHOP!!!,Positive
"This is so wierd. I went to single player and did the first test, but if i want to do the second one i fall through the stairs and i cant get back up...",Negative
